comment,title,views,dislikes,commentCount,likes,replies,id
soy yo o christian se quiere levantar a ro 🌚 jaja es manito del principio﻿,POSTUREO EN LA PLAYA FAIL,175041,197,1524,11671,0,oHQm8Iygz1E
Qué cámara usas?﻿,POSTUREO EN LA PLAYA FAIL,175041,197,1524,11671,0,oHQm8Iygz1E
el currice no se quita el gorro ni pa cagar.﻿,POSTUREO EN LA PLAYA FAIL,175041,197,1524,11671,0,oHQm8Iygz1E
ro y jp segireis subiendo bideos cuando tengais hijos?﻿,POSTUREO EN LA PLAYA FAIL,175041,197,1524,11671,0,oHQm8Iygz1E
Creo que Jp y Curri son como Damon y Stefan Salvatore y Ro es Elena 😏😏😏﻿,POSTUREO EN LA PLAYA FAIL,175041,197,1524,11671,0,oHQm8Iygz1E
Celo es gey?﻿,POSTUREO EN LA PLAYA FAIL,175041,197,1524,11671,0,oHQm8Iygz1E
si se enciende  antes de ke se encienda aprietas alt +r apretados los 2﻿,POSTUREO EN LA PLAYA FAIL,175041,197,1524,11671,0,oHQm8Iygz1E
No entiendo!!! Alguien me puede ayudar ? Es que este vale a salido el 29 de agosto pero curri y Ro ya habían subido fotos de la fiesta a Instagram.<br /><br />Alguien me puede explicar por qué ?﻿,POSTUREO EN LA PLAYA FAIL,175041,197,1524,11671,0,oHQm8Iygz1E
Si veis Cristian está muy pegado a ro en los últimos vapes﻿,POSTUREO EN LA PLAYA FAIL,175041,197,1524,11671,0,oHQm8Iygz1E
"<a href=""http://www.youtube.com/watch?v=oHQm8Iygz1E&amp;t=6m34s"">6:34</a> record nacional de gordas reunidas en 10 metros cuadrados﻿",POSTUREO EN LA PLAYA FAIL,175041,197,1524,11671,0,oHQm8Iygz1E
"Una pregunta, cuál es la relacion actual con rush? Se llevan bien? Él estuvo en esa fiesta creo y ni siquiera se vieron﻿",POSTUREO EN LA PLAYA FAIL,175041,197,1524,11671,0,oHQm8Iygz1E
habéis estado en Málaga y no me he enterado hasta ahora :(﻿,POSTUREO EN LA PLAYA FAIL,175041,197,1524,11671,0,oHQm8Iygz1E
Si son marido y mujer porque no duermen en la misma cama﻿,POSTUREO EN LA PLAYA FAIL,175041,197,1524,11671,0,oHQm8Iygz1E
"en <a href=""http://www.youtube.com/watch?v=iEMH1aDhPds&amp;t=10m33s"">10:33</a> otro también jugando﻿",ENCADENAR POKEPARADAS! Pokemon GO - [LuzuGames],1302162,1062,4667,83566,0,iEMH1aDhPds
gracias por el vídeo﻿,ENCADENAR POKEPARADAS! Pokemon GO - [LuzuGames],1302162,1062,4667,83566,0,iEMH1aDhPds
Me darias like?﻿,ENCADENAR POKEPARADAS! Pokemon GO - [LuzuGames],1302162,1062,4667,83566,0,iEMH1aDhPds
"Esto lo grabaste en Domingo verdad,lo deduzco porque no hay casi nadie por la calle,saludos y like﻿",ENCADENAR POKEPARADAS! Pokemon GO - [LuzuGames],1302162,1062,4667,83566,0,iEMH1aDhPds
rrgalame tu aipat -_-﻿,ENCADENAR POKEPARADAS! Pokemon GO - [LuzuGames],1302162,1062,4667,83566,0,iEMH1aDhPds
y la ultima que pokeparada que fue la superpokeparada siempre te dara el doble o solo una vez?﻿,ENCADENAR POKEPARADAS! Pokemon GO - [LuzuGames],1302162,1062,4667,83566,0,iEMH1aDhPds
luzuuuuu te crearon un rap﻿,ENCADENAR POKEPARADAS! Pokemon GO - [LuzuGames],1302162,1062,4667,83566,0,iEMH1aDhPds
¿Por qué a veces al pelear en un gimnasio sólo te permiten utilizar un pokémon y no seis?﻿,ENCADENAR POKEPARADAS! Pokemon GO - [LuzuGames],1302162,1062,4667,83566,0,iEMH1aDhPds
clickbait....(okno es por el video de dalasreview xDhay que hacer moda el clickbait porque lo ocupan para cualquier cosa las personas que quieren verse super cooool) haci que clickbait djfhakjgfshmbdc saludos desde chile﻿,ENCADENAR POKEPARADAS! Pokemon GO - [LuzuGames],1302162,1062,4667,83566,0,iEMH1aDhPds
migutatuvideo﻿,ENCADENAR POKEPARADAS! Pokemon GO - [LuzuGames],1302162,1062,4667,83566,0,iEMH1aDhPds
Buscando pokemons !﻿,ENCADENAR POKEPARADAS! Pokemon GO - [LuzuGames],1302162,1062,4667,83566,0,iEMH1aDhPds
"Oye chicos una pregunta, ¿No les pasa lo mismo pero sin hacer el truco? (Pregunto porque en una pokeparada me salio 5 items﻿",ENCADENAR POKEPARADAS! Pokemon GO - [LuzuGames],1302162,1062,4667,83566,0,iEMH1aDhPds
As otro vídeo de pokemon go cutrillo edition por fa soy tu fan﻿,ENCADENAR POKEPARADAS! Pokemon GO - [LuzuGames],1302162,1062,4667,83566,0,iEMH1aDhPds
luzu  me  gusta  tus   videos  de  pokemon go﻿,ENCADENAR POKEPARADAS! Pokemon GO - [LuzuGames],1302162,1062,4667,83566,0,iEMH1aDhPds
luzu cerca de deonde yo vivo hay un parque donde todas las pokeparas de cerca que son casi mas de 15  son graffitys y sabes que es lo mas grasioso que hay una notaria y es como no nos importa la notaria mejor en los grafitys﻿,ENCADENAR POKEPARADAS! Pokemon GO - [LuzuGames],1302162,1062,4667,83566,0,iEMH1aDhPds
luzu escucha tu rap es de bambiel esta pritty a fernan le iso otro XD﻿,ENCADENAR POKEPARADAS! Pokemon GO - [LuzuGames],1302162,1062,4667,83566,0,iEMH1aDhPds
"Hoy en mi escuela, salio un snorlax, lo malo es que soy nivel 14 y me salio de 173 de cp, no es bromaaa.....﻿",ENCADENAR POKEPARADAS! Pokemon GO - [LuzuGames],1302162,1062,4667,83566,0,iEMH1aDhPds
Buena luzu﻿,ENCADENAR POKEPARADAS! Pokemon GO - [LuzuGames],1302162,1062,4667,83566,0,iEMH1aDhPds
niño ratatatata﻿,ENCADENAR POKEPARADAS! Pokemon GO - [LuzuGames],1302162,1062,4667,83566,0,iEMH1aDhPds
"las probabilidades se multiplican, no se suman. La probabilidad de que te salgan dos horseas seguidos es del 0,05% si son 42 pokemon diferentes y la probabilidad de que salgan es la misma﻿",ENCADENAR POKEPARADAS! Pokemon GO - [LuzuGames],1302162,1062,4667,83566,0,iEMH1aDhPds
hola﻿,ENCADENAR POKEPARADAS! Pokemon GO - [LuzuGames],1302162,1062,4667,83566,0,iEMH1aDhPds
que sueño me dan tus videos...﻿,ENCADENAR POKEPARADAS! Pokemon GO - [LuzuGames],1302162,1062,4667,83566,0,iEMH1aDhPds
"<a href=""http://www.youtube.com/watch?v=iEMH1aDhPds&amp;t=5m10s"">5:10</a> No se porque pero mori de risa xD﻿",ENCADENAR POKEPARADAS! Pokemon GO - [LuzuGames],1302162,1062,4667,83566,0,iEMH1aDhPds
Hola﻿,ENCADENAR POKEPARADAS! Pokemon GO - [LuzuGames],1302162,1062,4667,83566,0,iEMH1aDhPds
cuando dijo que hitmonchan desapareció encontre uno yo :V﻿,ENCADENAR POKEPARADAS! Pokemon GO - [LuzuGames],1302162,1062,4667,83566,0,iEMH1aDhPds
Hola luzo!<br />Me llamo Magbis tengo una pregunta<br />si borro la app de pokemon go y luego la vuelvo a instalar se me borra todo el pregreso que ya llevo? <br />Saludos desde Guatemala.﻿,ENCADENAR POKEPARADAS! Pokemon GO - [LuzuGames],1302162,1062,4667,83566,0,iEMH1aDhPds
"si querer yo también he estado haciendo la súper parada claro pensando que avanzaba en el carro, buena por la info﻿",ENCADENAR POKEPARADAS! Pokemon GO - [LuzuGames],1302162,1062,4667,83566,0,iEMH1aDhPds
"<a href=""http://www.youtube.com/watch?v=iEMH1aDhPds&amp;t=6m37s"">6:37</a> LUZU... SE TU SECRETO DE INTERNET + GPS en busca de pokemons, estas haciendo una de las tarifas de (WI-FI + CELULAR) de tu movil, si quieren tus subs pueden explorar la tienda IOS, no recomiendo android porque no tiene esas tarifas de internet, ya pedi a santa claus un iPad mini 4 y pienso sacarle MUSHO partido, mi twitter es @yoelcerezogomez﻿",ENCADENAR POKEPARADAS! Pokemon GO - [LuzuGames],1302162,1062,4667,83566,0,iEMH1aDhPds
luzu acabo de descargar pokemon go como puedo conseguir monedas﻿,ENCADENAR POKEPARADAS! Pokemon GO - [LuzuGames],1302162,1062,4667,83566,0,iEMH1aDhPds
wNa﻿,ENCADENAR POKEPARADAS! Pokemon GO - [LuzuGames],1302162,1062,4667,83566,0,iEMH1aDhPds
luzu ven a chile hay muchas pokeparadas y tambien hay muchos pokemons que no hay en españa y que tu no tienes﻿,ENCADENAR POKEPARADAS! Pokemon GO - [LuzuGames],1302162,1062,4667,83566,0,iEMH1aDhPds
"JURO POR MI MADRE QUE LE DARE ME GUSTA A ESTE COMENTARIO<br />OK BRO YA LO JURASTE HAZLO<br />YH AHORA QUE TENGO TU ATENCION, TE INFORMO QUE EH SUBIDO UN NUEVO VIDEO JUGANDO POKEMON GO :D <br />DEJAME TU OPINION EN LA CAJA DE COMENTARIOS O TU RETO, ARE UN ESPECIAL AL LLEGAR A LOS 30 SUBS &lt;3<br />PDT :NO ES MI INTENCION QUE ME DIGAN SPAMER POR QUE LOS SPAMER SON LOS QUE PONEN UN MISMO COMENTARIO UNA Y OTRA VEZ EN UN VIDEO DICIENDO QUE SE SUSCRIBAN A SU CANAL Y TAL!<br /><br />mg si leíste hasta aquí﻿",ENCADENAR POKEPARADAS! Pokemon GO - [LuzuGames],1302162,1062,4667,83566,0,iEMH1aDhPds
no pasaste el examen de probabilidad verdad?? xDDDDDD﻿,ENCADENAR POKEPARADAS! Pokemon GO - [LuzuGames],1302162,1062,4667,83566,0,iEMH1aDhPds
Ali-A......﻿,ENCADENAR POKEPARADAS! Pokemon GO - [LuzuGames],1302162,1062,4667,83566,0,iEMH1aDhPds
En mi ciudad hay 5 pokeparadas solamente 😂😂😂😂﻿,ENCADENAR POKEPARADAS! Pokemon GO - [LuzuGames],1302162,1062,4667,83566,0,iEMH1aDhPds
grande luzu eres uno de los muchos youtubers que muestra tanta humildad.<br />Respeto para ti y muy buenos tus vídeos.<br />Saludos desde Chile :)﻿,ENCADENAR POKEPARADAS! Pokemon GO - [LuzuGames],1302162,1062,4667,83566,0,iEMH1aDhPds
sigue haciendo mas video de pokemon go﻿,ENCADENAR POKEPARADAS! Pokemon GO - [LuzuGames],1302162,1062,4667,83566,0,iEMH1aDhPds
"vendo cuentas chetadas de pokemon go o cheto las vuestras mismamente. Os doy los mejores pokemons como: Dragonite, snorlax, gyarados, charizard... con los mejores ataques, puntos de combate (mas de 2500) y IV(mas del 90%). Tambien os consigo los pokemons exclusivos de cada continente como son: farfetch´d, kangaskhan, tauro, mr.mime. Tambien subo de nivel y lleno inventarios de todo tipo de pokeballs, pociones...  vuestra pokedex practicamente completa. Y SOLO POR 5 EUROS!!!! NO VAIS A ENCONTRAR UN PRECIO MEJOR. PAGO POR PAYPAL(PRIMERO CHETO Y LUEGO ME PAGAN)<br />para mas informacion:<br />INSTAGRAM: hackcuentaspokemon<br />WHATSAPP. 634599709﻿",ENCADENAR POKEPARADAS! Pokemon GO - [LuzuGames],1302162,1062,4667,83566,0,iEMH1aDhPds
por que no atrapas pokemons luzu pokemon jajaja﻿,ENCADENAR POKEPARADAS! Pokemon GO - [LuzuGames],1302162,1062,4667,83566,0,iEMH1aDhPds
hay pokeparadas que te dan como 15 cosas y sin hacer eso V:﻿,ENCADENAR POKEPARADAS! Pokemon GO - [LuzuGames],1302162,1062,4667,83566,0,iEMH1aDhPds
se me estaba poniendo farruca la vieja jajaja﻿,ENCADENAR POKEPARADAS! Pokemon GO - [LuzuGames],1302162,1062,4667,83566,0,iEMH1aDhPds
una pregunta luzu como haces para sacar la caña d epescar en pokemon go?? hay? o no hay caña de pescar?﻿,ENCADENAR POKEPARADAS! Pokemon GO - [LuzuGames],1302162,1062,4667,83566,0,iEMH1aDhPds
like si pensab otra cosa﻿,ENCADENAR POKEPARADAS! Pokemon GO - [LuzuGames],1302162,1062,4667,83566,0,iEMH1aDhPds
hackeo pokemon go por 5 euros﻿,ENCADENAR POKEPARADAS! Pokemon GO - [LuzuGames],1302162,1062,4667,83566,0,iEMH1aDhPds
a mi me ha tocado 3 vulpix en los 3 huevos de 5 km ......﻿,ENCADENAR POKEPARADAS! Pokemon GO - [LuzuGames],1302162,1062,4667,83566,0,iEMH1aDhPds
"Es muy muy fácil hacerlo y decirlo desde Los Ángeles donde doblas cada esquina y aparecen 3 pokeparadas, aquí en España dificilmente..<br /><br /><br /><br />Pd: si lo haces 10 veces en la misma pokeparada sin salirte funciona igual.﻿",ENCADENAR POKEPARADAS! Pokemon GO - [LuzuGames],1302162,1062,4667,83566,0,iEMH1aDhPds
comentario 4600!okno -_-﻿,ENCADENAR POKEPARADAS! Pokemon GO - [LuzuGames],1302162,1062,4667,83566,0,iEMH1aDhPds
Que me muero bien muerta!! Puedo pinchar al careto desde el celular! GENIAL! :D﻿,ENCADENAR POKEPARADAS! Pokemon GO - [LuzuGames],1302162,1062,4667,83566,0,iEMH1aDhPds
as un Vlog con el Luzumobil Porfavor Luzu﻿,ENCADENAR POKEPARADAS! Pokemon GO - [LuzuGames],1302162,1062,4667,83566,0,iEMH1aDhPds
"&quot;Encadenar Pokeparadas es algo muy sencillo...&quot;<br />Claro que si campeón, siempre y cuándo vivas en Los Ángeles e.e﻿",ENCADENAR POKEPARADAS! Pokemon GO - [LuzuGames],1302162,1062,4667,83566,0,iEMH1aDhPds
puta madre aqui ni pokeparadas hay﻿,ENCADENAR POKEPARADAS! Pokemon GO - [LuzuGames],1302162,1062,4667,83566,0,iEMH1aDhPds
luzu usa este radar que se llama pokemesh es buenísimo <br />te ayudará muchísimo <br />saludos desde Colombia﻿,ENCADENAR POKEPARADAS! Pokemon GO - [LuzuGames],1302162,1062,4667,83566,0,iEMH1aDhPds
"si evolucionas tres pokemon cuando un huevo de 10 kilometros le falta 1 kilometro para eclocionar,aumentaras la posivilidad de que te salga un snorlax﻿",ENCADENAR POKEPARADAS! Pokemon GO - [LuzuGames],1302162,1062,4667,83566,0,iEMH1aDhPds
"Luzu la próxima vez que vayas a esa peatonal entra al Nike del <a href=""http://www.youtube.com/watch?v=iEMH1aDhPds&amp;t=00m37s"">00:37</a>, es que quiero ver ropa para comprar :$﻿",ENCADENAR POKEPARADAS! Pokemon GO - [LuzuGames],1302162,1062,4667,83566,0,iEMH1aDhPds
luzu fue a abrir la décima pokeparada  se murió Juan Gabriel xD﻿,ENCADENAR POKEPARADAS! Pokemon GO - [LuzuGames],1302162,1062,4667,83566,0,iEMH1aDhPds
en mi pueblo hay 3 pokeparadas nada mas :(﻿,ENCADENAR POKEPARADAS! Pokemon GO - [LuzuGames],1302162,1062,4667,83566,0,iEMH1aDhPds
hola que hace .-.﻿,ENCADENAR POKEPARADAS! Pokemon GO - [LuzuGames],1302162,1062,4667,83566,0,iEMH1aDhPds
tu te es fuerzas mucho﻿,ENCADENAR POKEPARADAS! Pokemon GO - [LuzuGames],1302162,1062,4667,83566,0,iEMH1aDhPds
da me tu pokemon﻿,ENCADENAR POKEPARADAS! Pokemon GO - [LuzuGames],1302162,1062,4667,83566,0,iEMH1aDhPds
Luzu games como le haces﻿,ENCADENAR POKEPARADAS! Pokemon GO - [LuzuGames],1302162,1062,4667,83566,0,iEMH1aDhPds
ya quisiera que hubieran tantas pokeparadas aquí en latinoamérica﻿,ENCADENAR POKEPARADAS! Pokemon GO - [LuzuGames],1302162,1062,4667,83566,1,iEMH1aDhPds
porfaviuuuurrrsss﻿,ENCADENAR POKEPARADAS! Pokemon GO - [LuzuGames],1302162,1062,4667,83566,0,iEMH1aDhPds
hey luzu puedes hacer un tutorial de como conseguir monedas en pokemon go﻿,ENCADENAR POKEPARADAS! Pokemon GO - [LuzuGames],1302162,1062,4667,83566,0,iEMH1aDhPds
e esoso esta chido chavalin﻿,ENCADENAR POKEPARADAS! Pokemon GO - [LuzuGames],1302162,1062,4667,83566,0,iEMH1aDhPds
yo tengo 2 huevos pobre luzu :v﻿,ENCADENAR POKEPARADAS! Pokemon GO - [LuzuGames],1302162,1062,4667,83566,0,iEMH1aDhPds
todo calza!!﻿,ENCADENAR POKEPARADAS! Pokemon GO - [LuzuGames],1302162,1062,4667,83566,0,iEMH1aDhPds
si alguien quiere jugar conmigo contactame en este video﻿,ENCADENAR POKEPARADAS! Pokemon GO - [LuzuGames],1302162,1062,4667,83566,0,iEMH1aDhPds
alguien tiene pokemon rubi omega?? cambio arceus por mew shiny el arceus esta al nivel 100 codigo de amigo 4098 6553 5225﻿,ENCADENAR POKEPARADAS! Pokemon GO - [LuzuGames],1302162,1062,4667,83566,0,iEMH1aDhPds
me a gustado﻿,ENCADENAR POKEPARADAS! Pokemon GO - [LuzuGames],1302162,1062,4667,83566,0,iEMH1aDhPds
luzu has mas d pokemon go t da mas visitas﻿,ENCADENAR POKEPARADAS! Pokemon GO - [LuzuGames],1302162,1062,4667,83566,0,iEMH1aDhPds
jajajaja tengo un truco que nadie sabe... si fallas una pokebola y la tocas cuando rueda en el piso si la tocas se te regresa pero si fallas en captura no se te devuelve﻿,ENCADENAR POKEPARADAS! Pokemon GO - [LuzuGames],1302162,1062,4667,83566,0,iEMH1aDhPds
La impresionante broma que me lo dijo un amigo y yo a mi lado a lado de su país en donde no te lo juro por mi culpa en todo el significado del amor que﻿,ENCADENAR POKEPARADAS! Pokemon GO - [LuzuGames],1302162,1062,4667,83566,0,iEMH1aDhPds
entonces lo hice ayer sin saberlo me salio asi por que si xD﻿,ENCADENAR POKEPARADAS! Pokemon GO - [LuzuGames],1302162,1062,4667,83566,0,iEMH1aDhPds
"alguien vio el pidgey del  minuto <a href=""http://www.youtube.com/watch?v=iEMH1aDhPds&amp;t=9m23s"">9:23</a> y dijo que era un shiny? y creo k lo era﻿",ENCADENAR POKEPARADAS! Pokemon GO - [LuzuGames],1302162,1062,4667,83566,0,iEMH1aDhPds
OLLE yo tengo un moto e2 y me encantaria que agas un video de como se puede solucionar una cosa : mi personaje cuando yo camino no camina tengo que andar poniendo inciensos en mi casa todo el dia y si se mueve se mueve un poquito y se pasa mi personaje es un flojo porfavor as un video de como solucionarlo﻿,ENCADENAR POKEPARADAS! Pokemon GO - [LuzuGames],1302162,1062,4667,83566,0,iEMH1aDhPds
se me abre un huevo 8:6 jjajajjjaj﻿,ENCADENAR POKEPARADAS! Pokemon GO - [LuzuGames],1302162,1062,4667,83566,0,iEMH1aDhPds
que triste en mi ciudad sólo hay una pokeparada﻿,ENCADENAR POKEPARADAS! Pokemon GO - [LuzuGames],1302162,1062,4667,83566,0,iEMH1aDhPds
jajaja si encima tenéis un huevo como yo﻿,ENCADENAR POKEPARADAS! Pokemon GO - [LuzuGames],1302162,1062,4667,83566,0,iEMH1aDhPds
fuaaaa esta lleno de pokeparadas donde yo vivo solo hay 5 o 6 como mucho﻿,ENCADENAR POKEPARADAS! Pokemon GO - [LuzuGames],1302162,1062,4667,83566,0,iEMH1aDhPds
mi peru﻿,ENCADENAR POKEPARADAS! Pokemon GO - [LuzuGames],1302162,1062,4667,83566,0,iEMH1aDhPds
Abro 10 pokeparadas seguidas.. Y PASA ESTO!﻿,ENCADENAR POKEPARADAS! Pokemon GO - [LuzuGames],1302162,1062,4667,83566,0,iEMH1aDhPds
Interesante con razón cuando abro muchas ya llega un punto en q me tira  un monton.﻿,ENCADENAR POKEPARADAS! Pokemon GO - [LuzuGames],1302162,1062,4667,83566,0,iEMH1aDhPds
jajaj me funciona que bueno gracias﻿,ENCADENAR POKEPARADAS! Pokemon GO - [LuzuGames],1302162,1062,4667,83566,0,iEMH1aDhPds
luzu si te doy mi cuenta me la mejoras es que aqui en ARGENTINA no se puede salir﻿,ENCADENAR POKEPARADAS! Pokemon GO - [LuzuGames],1302162,1062,4667,83566,0,iEMH1aDhPds
"hola luzu, como haces para tener tantos inciensos﻿",ENCADENAR POKEPARADAS! Pokemon GO - [LuzuGames],1302162,1062,4667,83566,0,iEMH1aDhPds
egg locke﻿,ENCADENAR POKEPARADAS! Pokemon GO - [LuzuGames],1302162,1062,4667,83566,0,iEMH1aDhPds
"En realidad la probabilidad es 1/42², un 0&#39;05% jajaja﻿",ENCADENAR POKEPARADAS! Pokemon GO - [LuzuGames],1302162,1062,4667,83566,0,iEMH1aDhPds
ni aunq sea en mi ciudad completa hay 10 pokeparadas :( por eso siempre me quedo sin pokebolas porq no hay muchas pokeparadas﻿,ENCADENAR POKEPARADAS! Pokemon GO - [LuzuGames],1302162,1062,4667,83566,0,iEMH1aDhPds
"JURO POR MI MADRE QUE LE DARE ME GUSTA A ESTE COMENTARIO<br />YA LO JURASTE HAZLO<br />AYUDAME A LLEGAR A LOS 100,000 SUBS  HAGO HACK DE JUEGOS PARA USTEDES﻿",ENCADENAR POKEPARADAS! Pokemon GO - [LuzuGames],1302162,1062,4667,83566,0,iEMH1aDhPds
por que no coje lo items﻿,ENCADENAR POKEPARADAS! Pokemon GO - [LuzuGames],1302162,1062,4667,83566,0,iEMH1aDhPds
"<a href=""http://www.youtube.com/watch?v=iEMH1aDhPds&amp;t=7m11s"">7:11</a> (7w7) :v﻿",ENCADENAR POKEPARADAS! Pokemon GO - [LuzuGames],1302162,1062,4667,83566,0,iEMH1aDhPds
Y si le pongo un módulo cebo ala pokeparada 🤔﻿,ENCADENAR POKEPARADAS! Pokemon GO - [LuzuGames],1302162,1062,4667,83566,0,iEMH1aDhPds
mubien lo asecho Luzu﻿,ENCADENAR POKEPARADAS! Pokemon GO - [LuzuGames],1302162,1062,4667,83566,0,iEMH1aDhPds
luzu encuentra un  pokemon lejendario﻿,ENCADENAR POKEPARADAS! Pokemon GO - [LuzuGames],1302162,1062,4667,83566,0,iEMH1aDhPds
"Una vez me paso eso de que me salieran 6 objetos de una pokepara, pero pense habia sido suerte no más :)﻿",ENCADENAR POKEPARADAS! Pokemon GO - [LuzuGames],1302162,1062,4667,83566,0,iEMH1aDhPds
Un desmadre﻿,ENCADENAR POKEPARADAS! Pokemon GO - [LuzuGames],1302162,1062,4667,83566,0,iEMH1aDhPds
A mi no me aparecio ni un Geodude :(﻿,ENCADENAR POKEPARADAS! Pokemon GO - [LuzuGames],1302162,1062,4667,83566,0,iEMH1aDhPds
"Benas a todos, tego una pregunta, como de cuanto es el diámetro del circulo que aparece en el suelo alrededor del avatar ? cuantos metros de alcance tiene ? gracias :D buen video, buen consejo :D﻿",ENCADENAR POKEPARADAS! Pokemon GO - [LuzuGames],1302162,1062,4667,83566,0,iEMH1aDhPds
habia una probabilidad de 1/1700 de que te tocaran dos horsea no 2 /84 jeje﻿,ENCADENAR POKEPARADAS! Pokemon GO - [LuzuGames],1302162,1062,4667,83566,0,iEMH1aDhPds
LUZU QUIERES UN PORYGON???﻿,ENCADENAR POKEPARADAS! Pokemon GO - [LuzuGames],1302162,1062,4667,83566,0,iEMH1aDhPds
&quot;CLICKBAIT CLICKBAIT CLICKBAIT&quot;<br />no es clickbait<br /><br />&quot;CLICKBAIT CLICKBAIT CLICKBAIT pero...&quot;<br />si lo es :v﻿,CLICKBAIT CLICKBAIT CLICKBAIT CLICKBAIT CLICKBAIT CLICKBAIT CLICKBAIT CLICKBAIT CLICKBAIT CLICKBAIT,1033244,5355,33121,103657,0,2KF19AGrmW0
lince puto te copias de WathTheGame ):v﻿,CLICKBAIT CLICKBAIT CLICKBAIT CLICKBAIT CLICKBAIT CLICKBAIT CLICKBAIT CLICKBAIT CLICKBAIT CLICKBAIT,1033244,5355,33121,103657,0,2KF19AGrmW0
da las que pasó con tu novia﻿,CLICKBAIT CLICKBAIT CLICKBAIT CLICKBAIT CLICKBAIT CLICKBAIT CLICKBAIT CLICKBAIT CLICKBAIT CLICKBAIT,1033244,5355,33121,103657,0,2KF19AGrmW0
"ESTE VÍDEO ES UN CLICK....BAI..... ok no es,broma xD﻿",CLICKBAIT CLICKBAIT CLICKBAIT CLICKBAIT CLICKBAIT CLICKBAIT CLICKBAIT CLICKBAIT CLICKBAIT CLICKBAIT,1033244,5355,33121,103657,0,2KF19AGrmW0
clickbait :&#39;) jaja﻿,CLICKBAIT CLICKBAIT CLICKBAIT CLICKBAIT CLICKBAIT CLICKBAIT CLICKBAIT CLICKBAIT CLICKBAIT CLICKBAIT,1033244,5355,33121,103657,0,2KF19AGrmW0
esto es clickbait  <br /><br /><br />ok no :V﻿,CLICKBAIT CLICKBAIT CLICKBAIT CLICKBAIT CLICKBAIT CLICKBAIT CLICKBAIT CLICKBAIT CLICKBAIT CLICKBAIT,1033244,5355,33121,103657,0,2KF19AGrmW0
😨entonces dalasreview y whathegame son la misma persona???😨😱😕﻿,CLICKBAIT CLICKBAIT CLICKBAIT CLICKBAIT CLICKBAIT CLICKBAIT CLICKBAIT CLICKBAIT CLICKBAIT CLICKBAIT,1033244,5355,33121,103657,0,2KF19AGrmW0
hahaha creo que te contratare como detective cuando sienta que mi novio me engaña! XD﻿,CLICKBAIT CLICKBAIT CLICKBAIT CLICKBAIT CLICKBAIT CLICKBAIT CLICKBAIT CLICKBAIT CLICKBAIT CLICKBAIT,1033244,5355,33121,103657,0,2KF19AGrmW0
"menudo clickbait jajajajajajajajajagasjsiwkd,d﻿",CLICKBAIT CLICKBAIT CLICKBAIT CLICKBAIT CLICKBAIT CLICKBAIT CLICKBAIT CLICKBAIT CLICKBAIT CLICKBAIT,1033244,5355,33121,103657,0,2KF19AGrmW0
"Este video es un clickbait porque en el titulo pone CLICKBAIT y en el video no haces clickbait, pero si eso es clickbait entonces si haces clickbait aunque eso no tiene ningun sentido...ESTE COMENTARIO TAMBIEN ES UN CLICKBAIT POR FALTA DE SENTIDO!!! :VVVVVVV﻿",CLICKBAIT CLICKBAIT CLICKBAIT CLICKBAIT CLICKBAIT CLICKBAIT CLICKBAIT CLICKBAIT CLICKBAIT CLICKBAIT,1033244,5355,33121,103657,0,2KF19AGrmW0
JAJAJAJAJA &quot;pinche Dalas puto&quot; jajajaja ay dios te amo demaciaoh x&#39;&#39;&#39;D jajajajajaja ay...﻿,CLICKBAIT CLICKBAIT CLICKBAIT CLICKBAIT CLICKBAIT CLICKBAIT CLICKBAIT CLICKBAIT CLICKBAIT CLICKBAIT,1033244,5355,33121,103657,0,2KF19AGrmW0
Deja el clickbait dalas﻿,CLICKBAIT CLICKBAIT CLICKBAIT CLICKBAIT CLICKBAIT CLICKBAIT CLICKBAIT CLICKBAIT CLICKBAIT CLICKBAIT,1033244,5355,33121,103657,0,2KF19AGrmW0
"Niño Rata: Dallaz as echo clikbait x q la oruja a aparesido en el minuto <a href=""http://www.youtube.com/watch?v=2KF19AGrmW0&amp;t=11m11s"">11:11</a> xD﻿",CLICKBAIT CLICKBAIT CLICKBAIT CLICKBAIT CLICKBAIT CLICKBAIT CLICKBAIT CLICKBAIT CLICKBAIT CLICKBAIT,1033244,5355,33121,103657,0,2KF19AGrmW0
Habla sobre german!﻿,CLICKBAIT CLICKBAIT CLICKBAIT CLICKBAIT CLICKBAIT CLICKBAIT CLICKBAIT CLICKBAIT CLICKBAIT CLICKBAIT,1033244,5355,33121,103657,0,2KF19AGrmW0
mi vida es un clickbait﻿,CLICKBAIT CLICKBAIT CLICKBAIT CLICKBAIT CLICKBAIT CLICKBAIT CLICKBAIT CLICKBAIT CLICKBAIT CLICKBAIT,1033244,5355,33121,103657,0,2KF19AGrmW0
Esto es Clickbait﻿,CLICKBAIT CLICKBAIT CLICKBAIT CLICKBAIT CLICKBAIT CLICKBAIT CLICKBAIT CLICKBAIT CLICKBAIT CLICKBAIT,1033244,5355,33121,103657,0,2KF19AGrmW0
"Sabéis que un ClickBait no es lo mismo que Título engañoso, verdad? Porque Dalas no lo sabe xD﻿",CLICKBAIT CLICKBAIT CLICKBAIT CLICKBAIT CLICKBAIT CLICKBAIT CLICKBAIT CLICKBAIT CLICKBAIT CLICKBAIT,1033244,5355,33121,103657,0,2KF19AGrmW0
este vídeo es CLICKBAIT solo porque lo disen retrasitos pambisitos muy imvesilitos﻿,CLICKBAIT CLICKBAIT CLICKBAIT CLICKBAIT CLICKBAIT CLICKBAIT CLICKBAIT CLICKBAIT CLICKBAIT CLICKBAIT,1033244,5355,33121,103657,0,2KF19AGrmW0
"Y a ver explico, el carajito pendejo solo decia que es un clickbait porque el leyo &quot;preguntas incomodas&quot; y para el ninio rata bobo ese una pregunta incomoda tiene contenido sexual y al ver que NO habia contenido sexual en las preguntas que hiciste, OBVIAMENTE, se le hizo un clickbait. En resumen, un pobre imbecil desde chiquito.﻿",CLICKBAIT CLICKBAIT CLICKBAIT CLICKBAIT CLICKBAIT CLICKBAIT CLICKBAIT CLICKBAIT CLICKBAIT CLICKBAIT,1033244,5355,33121,103657,0,2KF19AGrmW0
Tenes razon Dalas﻿,CLICKBAIT CLICKBAIT CLICKBAIT CLICKBAIT CLICKBAIT CLICKBAIT CLICKBAIT CLICKBAIT CLICKBAIT CLICKBAIT,1033244,5355,33121,103657,0,2KF19AGrmW0
"Dalas das asco en el minuto <a href=""http://www.youtube.com/watch?v=2KF19AGrmW0&amp;t=14m55s"">14:55</a> aparece una imagen que no lo dices en el video :l CLICKBAIT...﻿",CLICKBAIT CLICKBAIT CLICKBAIT CLICKBAIT CLICKBAIT CLICKBAIT CLICKBAIT CLICKBAIT CLICKBAIT CLICKBAIT,1033244,5355,33121,103657,0,2KF19AGrmW0
clickbate!!! XP﻿,CLICKBAIT CLICKBAIT CLICKBAIT CLICKBAIT CLICKBAIT CLICKBAIT CLICKBAIT CLICKBAIT CLICKBAIT CLICKBAIT,1033244,5355,33121,103657,0,2KF19AGrmW0
dalas=puta﻿,CLICKBAIT CLICKBAIT CLICKBAIT CLICKBAIT CLICKBAIT CLICKBAIT CLICKBAIT CLICKBAIT CLICKBAIT CLICKBAIT,1033244,5355,33121,103657,0,2KF19AGrmW0
Dalasito tontino explosibito cabisito ;v﻿,CLICKBAIT CLICKBAIT CLICKBAIT CLICKBAIT CLICKBAIT CLICKBAIT CLICKBAIT CLICKBAIT CLICKBAIT CLICKBAIT,1033244,5355,33121,103657,0,2KF19AGrmW0
en el titulo dice mucho clickbate asi que es CLICKBAIT INSTANTANEO!!!﻿,CLICKBAIT CLICKBAIT CLICKBAIT CLICKBAIT CLICKBAIT CLICKBAIT CLICKBAIT CLICKBAIT CLICKBAIT CLICKBAIT,1033244,5355,33121,103657,0,2KF19AGrmW0
La vida misma es un Clickbait...u.u﻿,CLICKBAIT CLICKBAIT CLICKBAIT CLICKBAIT CLICKBAIT CLICKBAIT CLICKBAIT CLICKBAIT CLICKBAIT CLICKBAIT,1033244,5355,33121,103657,0,2KF19AGrmW0
"bueno, si para salir en el canal de dalas tengo que llamarle clickbaiter pues! DALAS IJO D PUHTA KLIK BEITER D MIERDHA!  <br /><br /><br />es mentira dalas no me bloquees por favor:&quot;v﻿",CLICKBAIT CLICKBAIT CLICKBAIT CLICKBAIT CLICKBAIT CLICKBAIT CLICKBAIT CLICKBAIT CLICKBAIT CLICKBAIT,1033244,5355,33121,103657,0,2KF19AGrmW0
El titulo es Clickbait﻿,CLICKBAIT CLICKBAIT CLICKBAIT CLICKBAIT CLICKBAIT CLICKBAIT CLICKBAIT CLICKBAIT CLICKBAIT CLICKBAIT,1033244,5355,33121,103657,0,2KF19AGrmW0
hola﻿,CLICKBAIT CLICKBAIT CLICKBAIT CLICKBAIT CLICKBAIT CLICKBAIT CLICKBAIT CLICKBAIT CLICKBAIT CLICKBAIT,1033244,5355,33121,103657,0,2KF19AGrmW0
