comment,title,views,dislikes,commentCount,likes,replies,id
────────▌▒█───────────▄▀▒▌<br />────────▌▒▒▀▄───────▄▀▒▒▒▐<br />───────▐▄▀▒▒▀▀▀▀▄▄▄▀▒▒▒▒▒▐<br />─────▄▄▀▒▒▒▒▒▒▒▒▒▒▒█▒▒▄█▒▐<br />───▄▀▒▒▒▒▒▒▒▒▒▒▒▒▒▒▒▀██▀▒▌<br />──▐▒▒▒▄▄▄▒▒▒▒▒▒▒▒▒▒▒▒▒▀▄▒▒▌                   <br />──▌▒▒▐▄█▀▒▒▒▒▄▀█▄▒▒▒▒▒▒▒█▒▐<br />─▐▒▒▒▒▒▒▒▒▒▒▒▌██▀▒▒▒▒▒▒▒▒▀▄▌      La invasión ha comenzado.....<br />─▌▒▀▄██▄▒▒▒▒▒▒▒▒▒▒▒░░░░▒▒▒▒▌<br />─▌▀▐▄█▄█▌▄▒▀▒▒▒▒▒▒░░░░░░▒▒▒▐<br />▐▒▀▐▀▐▀▒▒▄▄▒▄▒▒▒▒▒░░░░░░▒▒▒▒▌Copia y pega esto en todos los videos <br />▐▒▒▒▀▀▄▄▒▒▒▄▒▒▒▒ ▒▒░░░░░░▒▒▒▐      que veas<br />─▌▒▒▒▒▒▒▀▀▀▒▒▒▒▒▒▒▒░░░░▒▒▒▒▌      <br />─▐▒▒▒▒▒▒▒▒▒▒▒▒▒▒▒▒▒▒▒▒▒▒▒▒▐<br />──▀▄▒▒▒▒▒▒▒▒▒▒▒▒▒▒▒▒▒▄▒▒▒▒▌<br />────▀▄▒▒▒▒▒▒▒▒▒▒▄▄▄▀▒▒▒▒▄▀<br />───▐▀▒▀▄▄▄▄▄▄▀▀▀▒▒▒▒▒▄▄▀<br />──▐▒▒▒▒▒▒▒▒▒▒▒▒▒▒▒▒﻿,"¡AMOR Y MAS AMOR! LUCKY BLOCKS | Minecraft Con Sara, Luh Y Exo",294854,186,1281,15639,0,Kwl9PDpAqrA
gona hace una serie de undertale esta re copa﻿,"¡AMOR Y MAS AMOR! LUCKY BLOCKS | Minecraft Con Sara, Luh Y Exo",294854,186,1281,15639,0,Kwl9PDpAqrA
"entre goluh, gorinha exagono, lurinha y exorinha, menuda orgia se montan aqui heeee, todos con todos XD﻿","¡AMOR Y MAS AMOR! LUCKY BLOCKS | Minecraft Con Sara, Luh Y Exo",294854,186,1281,15639,0,Kwl9PDpAqrA
luhrinha y gonexo son reales &lt;3﻿,"¡AMOR Y MAS AMOR! LUCKY BLOCKS | Minecraft Con Sara, Luh Y Exo",294854,186,1281,15639,0,Kwl9PDpAqrA
"<a href=""http://www.youtube.com/watch?v=Kwl9PDpAqrA&amp;t=6m17s"">6:17</a> <a href=""http://www.youtube.com/watch?v=Kwl9PDpAqrA&amp;t=6m17s"">6:17</a> Lurinha es real!!!﻿","¡AMOR Y MAS AMOR! LUCKY BLOCKS | Minecraft Con Sara, Luh Y Exo",294854,186,1281,15639,0,Kwl9PDpAqrA
Pasa el pack﻿,"¡AMOR Y MAS AMOR! LUCKY BLOCKS | Minecraft Con Sara, Luh Y Exo",294854,186,1281,15639,0,Kwl9PDpAqrA
────────▌▒█───────────▄▀▒▌<br />────────▌▒▒▀▄───────▄▀▒▒▒▐<br />───────▐▄▀▒▒▀▀▀▀▄▄▄▀▒▒▒▒▒▐<br />─────▄▄▀▒▒▒▒▒▒▒▒▒▒▒█▒▒▄█▒▐<br />───▄▀▒▒▒▒▒▒▒▒▒▒▒▒▒▒▒▀██▀▒▌<br />──▐▒▒▒▄▄▄▒▒▒▒▒▒▒▒▒▒▒▒▒▀▄▒▒▌                   <br />──▌▒▒▐▄█▀▒▒▒▒▄▀█▄▒▒▒▒▒▒▒█▒▐<br />─▐▒▒▒▒▒▒▒▒▒▒▒▌██▀▒▒▒▒▒▒▒▒▀▄▌      La invasión ha comenzado.....<br />─▌▒▀▄██▄▒▒▒▒▒▒▒▒▒▒▒░░░░▒▒▒▒▌<br />─▌▀▐▄█▄█▌▄▒▀▒▒▒▒▒▒░░░░░░▒▒▒▐<br />▐▒▀▐▀▐▀▒▒▄▄▒▄▒▒▒▒▒░░░░░░▒▒▒▒▌Copia y pega esto en todos los videos <br />▐▒▒▒▀▀▄▄▒▒▒▄▒▒▒▒ ▒▒░░░░░░▒▒▒▐      que veas<br />─▌▒▒▒▒▒▒▀▀▀▒▒▒▒▒▒▒▒░░░░▒▒▒▒▌      <br />─▐▒▒▒▒▒▒▒▒▒▒▒▒▒▒▒▒▒▒▒▒▒▒▒▒▐<br />──▀▄▒▒▒▒▒▒▒▒▒▒▒▒▒▒▒▒▒▄▒▒▒▒▌<br />────▀▄▒▒▒▒▒▒▒▒▒▒▄▄▄▀▒▒▒▒▄▀<br />───▐▀▒▀▄▄▄▄▄▄▀▀▀▒▒▒▒▒▄▄▀<br />──▐▒▒▒▒▒▒▒▒▒▒▒▒▒▒▒▒<br /><br />    <br />29﻿,"¡AMOR Y MAS AMOR! LUCKY BLOCKS | Minecraft Con Sara, Luh Y Exo",294854,186,1281,15639,0,Kwl9PDpAqrA
Like si tas suscribido.   A un porron canales  i. Te. Peta las  notificaciones. Solo. Ves videos. De. Gona﻿,"¡AMOR Y MAS AMOR! LUCKY BLOCKS | Minecraft Con Sara, Luh Y Exo",294854,186,1281,15639,0,Kwl9PDpAqrA
lhuriña is REAL!!!!!﻿,"¡AMOR Y MAS AMOR! LUCKY BLOCKS | Minecraft Con Sara, Luh Y Exo",294854,186,1281,15639,0,Kwl9PDpAqrA
luhriha is real confirmed﻿,"¡AMOR Y MAS AMOR! LUCKY BLOCKS | Minecraft Con Sara, Luh Y Exo",294854,186,1281,15639,0,Kwl9PDpAqrA
La primera vez que te vi solo. Tenias menos de 566.77 subs i ahora mas de dosss millones like si tu quieres que gona te de un cok﻿,"¡AMOR Y MAS AMOR! LUCKY BLOCKS | Minecraft Con Sara, Luh Y Exo",294854,186,1281,15639,0,Kwl9PDpAqrA
────────▌▒█───────────▄▀▒▌<br />────────▌▒▒▀▄───────▄▀▒▒▒▐<br />───────▐▄▀▒▒▀▀▀▀▄▄▄▀▒▒▒▒▒▐<br />─────▄▄▀▒▒▒▒▒▒▒▒▒▒▒█▒▒▄█▒▐<br />───▄▀▒▒▒▒▒▒▒▒▒▒▒▒▒▒▒▀██▀▒▌<br />──▐▒▒▒▄▄▄▒▒▒▒▒▒▒▒▒▒▒▒▒▀▄▒▒▌                   <br />──▌▒▒▐▄█▀▒▒▒▒▄▀█▄▒▒▒▒▒▒▒█▒▐<br />─▐▒▒▒▒▒▒▒▒▒▒▒▌██▀▒▒▒▒▒▒▒▒▀▄▌      La invasión ha comenzado.....<br />─▌▒▀▄██▄▒▒▒▒▒▒▒▒▒▒▒░░░░▒▒▒▒▌<br />─▌▀▐▄█▄█▌▄▒▀▒▒▒▒▒▒░░░░░░▒▒▒▐<br />▐▒▀▐▀▐▀▒▒▄▄▒▄▒▒▒▒▒░░░░░░▒▒▒▒▌Copia y pega esto en todos los videos <br />▐▒▒▒▀▀▄▄▒▒▒▄▒▒▒▒ ▒▒░░░░░░▒▒▒▐      que veas<br />─▌▒▒▒▒▒▒▀▀▀▒▒▒▒▒▒▒▒░░░░▒▒▒▒▌      <br />─▐▒▒▒▒▒▒▒▒▒▒▒▒▒▒▒▒▒▒▒▒▒▒▒▒▐<br />──▀▄▒▒▒▒▒▒▒▒▒▒▒▒▒▒▒▒▒▄▒▒▒▒▌<br />────▀▄▒▒▒▒▒▒▒▒▒▒▄▄▄▀▒▒▒▒▄▀<br />───▐▀▒▀▄▄▄▄▄▄▀▀▀▒▒▒▒▒▄▄▀<br />──▐▒▒▒▒▒▒▒▒▒▒▒▒▒▒▒▒﻿,"¡AMOR Y MAS AMOR! LUCKY BLOCKS | Minecraft Con Sara, Luh Y Exo",294854,186,1281,15639,0,Kwl9PDpAqrA
soy nueva sud﻿,"¡AMOR Y MAS AMOR! LUCKY BLOCKS | Minecraft Con Sara, Luh Y Exo",294854,186,1281,15639,0,Kwl9PDpAqrA
lurinha ya no mas exorinha﻿,"¡AMOR Y MAS AMOR! LUCKY BLOCKS | Minecraft Con Sara, Luh Y Exo",294854,186,1281,15639,0,Kwl9PDpAqrA
"Gona, juega roblox﻿","¡AMOR Y MAS AMOR! LUCKY BLOCKS | Minecraft Con Sara, Luh Y Exo",294854,186,1281,15639,0,Kwl9PDpAqrA
Gona en la cita... Luh que te parto mientras duermes GG..﻿,"¡AMOR Y MAS AMOR! LUCKY BLOCKS | Minecraft Con Sara, Luh Y Exo",294854,186,1281,15639,0,Kwl9PDpAqrA
niño ratatatata﻿,"¡AMOR Y MAS AMOR! LUCKY BLOCKS | Minecraft Con Sara, Luh Y Exo",294854,186,1281,15639,0,Kwl9PDpAqrA
siuuuuuu mas luckys ggg paphu﻿,"¡AMOR Y MAS AMOR! LUCKY BLOCKS | Minecraft Con Sara, Luh Y Exo",294854,186,1281,15639,0,Kwl9PDpAqrA
exorina se acabo﻿,"¡AMOR Y MAS AMOR! LUCKY BLOCKS | Minecraft Con Sara, Luh Y Exo",294854,186,1281,15639,0,Kwl9PDpAqrA
Lurinha y Exagono is real 100% no feick﻿,"¡AMOR Y MAS AMOR! LUCKY BLOCKS | Minecraft Con Sara, Luh Y Exo",294854,186,1281,15639,0,Kwl9PDpAqrA
Like﻿,"¡AMOR Y MAS AMOR! LUCKY BLOCKS | Minecraft Con Sara, Luh Y Exo",294854,186,1281,15639,0,Kwl9PDpAqrA
XD﻿,"¡AMOR Y MAS AMOR! LUCKY BLOCKS | Minecraft Con Sara, Luh Y Exo",294854,186,1281,15639,0,Kwl9PDpAqrA
ya no es exoriña ahora es lhuriña﻿,"¡AMOR Y MAS AMOR! LUCKY BLOCKS | Minecraft Con Sara, Luh Y Exo",294854,186,1281,15639,0,Kwl9PDpAqrA
conoscan mi canal es VerPi Geymer﻿,"¡AMOR Y MAS AMOR! LUCKY BLOCKS | Minecraft Con Sara, Luh Y Exo",294854,186,1281,15639,0,Kwl9PDpAqrA
────────▌▒█───────────▄▀▒▌<br />────────▌▒▒▀▄───────▄▀▒▒▒▐<br />───────▐▄▀▒▒▀▀▀▀▄▄▄▀▒▒▒▒▒▐<br />─────▄▄▀▒▒▒▒▒▒▒▒▒▒▒█▒▒▄█▒▐<br />───▄▀▒▒▒▒▒▒▒▒▒▒▒▒▒▒▒▀██▀▒▌<br />──▐▒▒▒▄▄▄▒▒▒▒▒▒▒▒▒▒▒▒▒▀▄▒▒▌                   <br />──▌▒▒▐▄█▀▒▒▒▒▄▀█▄▒▒▒▒▒▒▒█▒▐<br />─▐▒▒▒▒▒▒▒▒▒▒▒▌██▀▒▒▒▒▒▒▒▒▀▄▌      La invasión ha comenzado.....<br />─▌▒▀▄██▄▒▒▒▒▒▒▒▒▒▒▒░░░░▒▒▒▒▌<br />─▌▀▐▄█▄█▌▄▒▀▒▒▒▒▒▒░░░░░░▒▒▒▐<br />▐▒▀▐▀▐▀▒▒▄▄▒▄▒▒▒▒▒░░░░░░▒▒▒▒▌Copia y pega esto en todos los videos <br />▐▒▒▒▀▀▄▄▒▒▒▄▒▒▒▒ ▒▒░░░░░░▒▒▒▐      que veas<br />─▌▒▒▒▒▒▒▀▀▀▒▒▒▒▒▒▒▒░░░░▒▒▒▒▌      <br />─▐▒▒▒▒▒▒▒▒▒▒▒▒▒▒▒▒▒▒▒▒▒▒▒▒▐<br />──▀▄▒▒▒▒▒▒▒▒▒▒▒▒▒▒▒▒▒▄▒▒▒▒▌<br />────▀▄▒▒▒▒▒▒▒▒▒▒▄▄▄▀▒▒▒▒▄▀<br />───▐▀▒▀▄▄▄▄▄▄▀▀▀▒▒▒▒▒▄▄▀<br />──▐▒▒▒▒▒▒▒▒▒▒▒▒▒▒▒▒﻿,"¡AMOR Y MAS AMOR! LUCKY BLOCKS | Minecraft Con Sara, Luh Y Exo",294854,186,1281,15639,0,Kwl9PDpAqrA
Like si te gusta más Luhrinha en vez de Exorinha﻿,"¡AMOR Y MAS AMOR! LUCKY BLOCKS | Minecraft Con Sara, Luh Y Exo",294854,186,1281,15639,0,Kwl9PDpAqrA
luhrinha is real !!﻿,"¡AMOR Y MAS AMOR! LUCKY BLOCKS | Minecraft Con Sara, Luh Y Exo",294854,186,1281,15639,0,Kwl9PDpAqrA
"<a href=""http://www.youtube.com/watch?v=Kwl9PDpAqrA&amp;t=5m30s"">5:30</a> luriha comfirmed﻿","¡AMOR Y MAS AMOR! LUCKY BLOCKS | Minecraft Con Sara, Luh Y Exo",294854,186,1281,15639,0,Kwl9PDpAqrA
luhriñah_3 and exona89 is rial men is REALLLLLLLLLLLLLLL﻿,"¡AMOR Y MAS AMOR! LUCKY BLOCKS | Minecraft Con Sara, Luh Y Exo",294854,186,1281,15639,0,Kwl9PDpAqrA
sharluh es real﻿,"¡AMOR Y MAS AMOR! LUCKY BLOCKS | Minecraft Con Sara, Luh Y Exo",294854,186,1281,15639,0,Kwl9PDpAqrA
"<a href=""http://www.youtube.com/watch?v=Kwl9PDpAqrA&amp;t=5m23s"">5:23</a> minuto epico﻿","¡AMOR Y MAS AMOR! LUCKY BLOCKS | Minecraft Con Sara, Luh Y Exo",294854,186,1281,15639,0,Kwl9PDpAqrA
░░░░░░░░░░░░░░░░░░░░░░░░██████████<br />░░░░░░░░░░░░░░░░░░░░████░░░░░░░░░░██<br />░░░░░░░░░░░░░░░░░░██░░░░░░░░░░░░░░░░██<br />░░░░░░░░░░░░░░░░██░░░░░░░░░░░░░░░░░░██<br />░░░░░░░░░░░░░░░░██░░░░░░░░░░░░██░░░░████  <br />░░░░░░░░░░░░░░░░██░░░░░░░░██████░░██░░██<br />░░░░░░░░░░░░░░░░██░░░░██░░░░░░░░░░░░░░█<br />░░░░░░░░░░░░░░░░░░██░░░░██████░░░░██████<br />░░░░░░░░░░░░░░░░░░██░░░░░░░░░░░░██░░████<br />░░░░░░░░░░░░░░██████░░██░░░░░░░░░░░░██<br />░░░░░░░░██████░░░░░░██░░██████████████<br />██░░░░██░░░░██████████░░████░░██░░████████<br />██████░░░░██░░░░░░██░░██░░██░░██░░████░░░░██<br />██░░░░░░██░░░░░░░░░░██░░██░░████░░████░░░░░░██<br />██░░░░░░██░░░░░░░░░░██░░░░██░░░░██░░██░░░░░░██<br />░░██░░░░████████░░░░░░██░░░░████████████░░██░░██<br />░░░░██░░██░░░░░░████░░░░██████░░░░░░██░░██░░██<br />░░░░░░██████████░░██░░░░░░██░░░░░░██░░██░░████                 <br />░░░░░░░░░░████████░░░░░░██░░████████░░██████████                    <br />░░░░░░░░░░████░░██░░░░░░██████░░░░████████████████                   <br />░░░░░░░░████░░░░████░░░░░░░░░░░░░░░░░░██░░██████<br />░░░░░░░░████████░░██████░░░░░░░░░░░░██<br />░░░░░░░░░░████░░░░██░░████████████████<br />░░░░░░░░░░░░██░░██░░░░░░░░░░██░░██░░██<br />░░░░░░░░░░░░░░██████░░░░░░██████████<br />░░░░░░░░░░░░░░░░░░████░░░░██████<br />░░░░░░░░░░░░░░░░░░██░░░░██████████<br />░░░░░░░░░░░░░░░░░░░░████░░██████░░██<br />░░░░░░░░░░░░░░░░░░░░██░░██░░░░░░████<br />░░░░░░░░░░░░░░░░░░░░██░░░░██████░░██<br />░░░░░░░░░░░░░░░░░░░░░░████░░░░░░██<br />░░░░░░░░░░░░░░░░░░░░░░████████████<br />░░░░░░░░░░░░░░░░░░░░██████░░░░████<br />░░░░░░░░░░░░░░░░░░░░████░░░░████████<br />░░░░░░░░░░░░░░░░░░██████░░░░██░░░░██<br />░░░░░░░░░░░░░░░░██░░░░██░░░░████████<br />░░░░░░░░░░░░░░░░████████░░░░██░░░░██<br />░░░░░░░░░░░░░░░░████░░██░░░░████████<br />░░░░░░░░░░░░████░░░░████░░░░██░░░░██████<br />░░░░░░░░░░██░░░░░░░░░░██░░░░██░░██░░░░░░██<br />░░░░░░░░░░██░░░░░░░░████░░░░██░░░░░░░░░░██<br />SI JUGASTE UNDERTALE SABRAS QUIEN ES﻿,"¡AMOR Y MAS AMOR! LUCKY BLOCKS | Minecraft Con Sara, Luh Y Exo",294854,186,1281,15639,0,Kwl9PDpAqrA
"Yo en el amor <a href=""http://www.youtube.com/watch?v=Kwl9PDpAqrA&amp;t=6m26s"">6:26</a> <br />pd:soy gona﻿","¡AMOR Y MAS AMOR! LUCKY BLOCKS | Minecraft Con Sara, Luh Y Exo",294854,186,1281,15639,0,Kwl9PDpAqrA
:D GONA ME MANDAS U SALUDO﻿,"¡AMOR Y MAS AMOR! LUCKY BLOCKS | Minecraft Con Sara, Luh Y Exo",294854,186,1281,15639,0,Kwl9PDpAqrA
"exorinha pasó lurinha esta pasando , sólo falta gorinha XD﻿","¡AMOR Y MAS AMOR! LUCKY BLOCKS | Minecraft Con Sara, Luh Y Exo",294854,186,1281,15639,0,Kwl9PDpAqrA
like si prefieres a exorinha antes de que a lurinha﻿,"¡AMOR Y MAS AMOR! LUCKY BLOCKS | Minecraft Con Sara, Luh Y Exo",294854,186,1281,15639,0,Kwl9PDpAqrA
gona matalos antes de que tengan crías(X_D)﻿,"¡AMOR Y MAS AMOR! LUCKY BLOCKS | Minecraft Con Sara, Luh Y Exo",294854,186,1281,15639,0,Kwl9PDpAqrA
(7_7) omfg﻿,"¡AMOR Y MAS AMOR! LUCKY BLOCKS | Minecraft Con Sara, Luh Y Exo",294854,186,1281,15639,0,Kwl9PDpAqrA
lurinha is very real  primero tragamundos y ahora la cita﻿,"¡AMOR Y MAS AMOR! LUCKY BLOCKS | Minecraft Con Sara, Luh Y Exo",294854,186,1281,15639,0,Kwl9PDpAqrA
luh x sarah confirmed :v﻿,"¡AMOR Y MAS AMOR! LUCKY BLOCKS | Minecraft Con Sara, Luh Y Exo",294854,186,1281,15639,2,Kwl9PDpAqrA
"vaya jamba y vaya culo lleva, mejor que la de taiwan﻿",Rels B - Vamos a Mirarnos (Prod. IBS) [LeFLMs],220833,463,768,10219,0,62GBxxExuC8
s&#39;iesta shet  es lo q&#39;hay calmaio mi mixtapepepepe﻿,Rels B - Vamos a Mirarnos (Prod. IBS) [LeFLMs],220833,463,768,10219,0,62GBxxExuC8
&quot;Mary Jane ha dado dislike a este vídeo&quot;﻿,Rels B - Vamos a Mirarnos (Prod. IBS) [LeFLMs],220833,463,768,10219,0,62GBxxExuC8
vamo a mirarno👐﻿,Rels B - Vamos a Mirarnos (Prod. IBS) [LeFLMs],220833,463,768,10219,0,62GBxxExuC8
"letra muy basica, me esperaba mas curro en ella﻿",Rels B - Vamos a Mirarnos (Prod. IBS) [LeFLMs],220833,463,768,10219,0,62GBxxExuC8
"Tremendo Rels, como siempre pa&#39; que engañarnos. Alguien más nota el paralelismo con los temas que está sacando C.Tangana pero con 2 meses de diferencia? Siguen como la misma secuencia no? No digo que se copie ni mucho menos, ni entro en gustos, que para eso, colores.﻿",Rels B - Vamos a Mirarnos (Prod. IBS) [LeFLMs],220833,463,768,10219,0,62GBxxExuC8
alguien tendrá el insta de esa mujer por dios!! jaja﻿,Rels B - Vamos a Mirarnos (Prod. IBS) [LeFLMs],220833,463,768,10219,0,62GBxxExuC8
OMG 👍La Mejor ❤﻿,Rels B - Vamos a Mirarnos (Prod. IBS) [LeFLMs],220833,463,768,10219,0,62GBxxExuC8
vaya perráncana﻿,Rels B - Vamos a Mirarnos (Prod. IBS) [LeFLMs],220833,463,768,10219,0,62GBxxExuC8
"yo te escuchaba en tus primeras rolas chidas billetes falsos y esas canciones y evolucionaste machín,  pero lástima que todo lo qie rifa en estos tiempos se hace moda y lo escuchan personas sin saber ni que pedo con el hip hop﻿",Rels B - Vamos a Mirarnos (Prod. IBS) [LeFLMs],220833,463,768,10219,0,62GBxxExuC8
Ste supersub﻿,Rels B - Vamos a Mirarnos (Prod. IBS) [LeFLMs],220833,463,768,10219,0,62GBxxExuC8
¿Cuánto cobra una de esas para hacer un videoclip así?  Pregunta seria.﻿,Rels B - Vamos a Mirarnos (Prod. IBS) [LeFLMs],220833,463,768,10219,0,62GBxxExuC8
fuera mejor si el titulo fuera TODO FUE RAPIDO .pilas parse﻿,Rels B - Vamos a Mirarnos (Prod. IBS) [LeFLMs],220833,463,768,10219,0,62GBxxExuC8
Que paz transmite este hombre muchacho﻿,Rels B - Vamos a Mirarnos (Prod. IBS) [LeFLMs],220833,463,768,10219,0,62GBxxExuC8
jajajaja las tias pasan de ti no mientas!!!!﻿,Rels B - Vamos a Mirarnos (Prod. IBS) [LeFLMs],220833,463,768,10219,0,62GBxxExuC8
quien es la puta del videoclip? nombre??? gracias﻿,Rels B - Vamos a Mirarnos (Prod. IBS) [LeFLMs],220833,463,768,10219,0,62GBxxExuC8
pedazo de pringado jajaj﻿,Rels B - Vamos a Mirarnos (Prod. IBS) [LeFLMs],220833,463,768,10219,0,62GBxxExuC8
molaba mas cuando se llamaba crema...﻿,Rels B - Vamos a Mirarnos (Prod. IBS) [LeFLMs],220833,463,768,10219,0,62GBxxExuC8
la escucho y me pongo cachondo os lo juro me paso lo mismo con the wekend﻿,Rels B - Vamos a Mirarnos (Prod. IBS) [LeFLMs],220833,463,768,10219,0,62GBxxExuC8
"Lo que digan los vecinos ya me da igual, avísales de que pronto me conocerán.﻿",Rels B - Vamos a Mirarnos (Prod. IBS) [LeFLMs],220833,463,768,10219,0,62GBxxExuC8
donde quedo young classic? otro vendido mass﻿,Rels B - Vamos a Mirarnos (Prod. IBS) [LeFLMs],220833,463,768,10219,0,62GBxxExuC8
Vaya culamen puto Flakkk﻿,Rels B - Vamos a Mirarnos (Prod. IBS) [LeFLMs],220833,463,768,10219,0,62GBxxExuC8
cada tema es mas bueno﻿,Rels B - Vamos a Mirarnos (Prod. IBS) [LeFLMs],220833,463,768,10219,0,62GBxxExuC8
Que mal canta este pavo﻿,Rels B - Vamos a Mirarnos (Prod. IBS) [LeFLMs],220833,463,768,10219,0,62GBxxExuC8
Te quiero ver con Bejito. :( ❤﻿,Rels B - Vamos a Mirarnos (Prod. IBS) [LeFLMs],220833,463,768,10219,0,62GBxxExuC8
"Es un rollito distinto al que sueles subir, está guapo loco!<br />Aún así, me mola más el Rels activao que el emocional ;p!﻿",Rels B - Vamos a Mirarnos (Prod. IBS) [LeFLMs],220833,463,768,10219,0,62GBxxExuC8
jajajajja el cigarro del inicio jajajaja etse pendejo cree que es marihuana pinche chamaco taradp﻿,Rels B - Vamos a Mirarnos (Prod. IBS) [LeFLMs],220833,463,768,10219,0,62GBxxExuC8
mary jane 2.0?﻿,Rels B - Vamos a Mirarnos (Prod. IBS) [LeFLMs],220833,463,768,10219,0,62GBxxExuC8
Ese culo la concha de la lora﻿,Rels B - Vamos a Mirarnos (Prod. IBS) [LeFLMs],220833,463,768,10219,0,62GBxxExuC8
"Me parece q tiene bastante poca chicha, todos tus temas tienen un rollo especial, pero este me parece q no. Aun asi me parece un 6/10﻿",Rels B - Vamos a Mirarnos (Prod. IBS) [LeFLMs],220833,463,768,10219,0,62GBxxExuC8
ostia q temazo﻿,Rels B - Vamos a Mirarnos (Prod. IBS) [LeFLMs],220833,463,768,10219,0,62GBxxExuC8
esta mu guapaa pero si no robas frasecillas mejor xdd﻿,Rels B - Vamos a Mirarnos (Prod. IBS) [LeFLMs],220833,463,768,10219,0,62GBxxExuC8
Tiene estilo hasta para follar con los calcetines puestos jajajajaja﻿,Rels B - Vamos a Mirarnos (Prod. IBS) [LeFLMs],220833,463,768,10219,0,62GBxxExuC8
Lo único bueno es la tia﻿,Rels B - Vamos a Mirarnos (Prod. IBS) [LeFLMs],220833,463,768,10219,0,62GBxxExuC8
temasoo tu﻿,Rels B - Vamos a Mirarnos (Prod. IBS) [LeFLMs],220833,463,768,10219,0,62GBxxExuC8
"me esperaba un poquito más,  porque ningun rapero es humilde con las mujeres?y todos van de genios haha comerme el rabo﻿",Rels B - Vamos a Mirarnos (Prod. IBS) [LeFLMs],220833,463,768,10219,0,62GBxxExuC8
molaba más cuando era..﻿,Rels B - Vamos a Mirarnos (Prod. IBS) [LeFLMs],220833,463,768,10219,0,62GBxxExuC8
que es esta basura﻿,Rels B - Vamos a Mirarnos (Prod. IBS) [LeFLMs],220833,463,768,10219,1,62GBxxExuC8
"Que booty el de la chica, buen tema relax.﻿",Rels B - Vamos a Mirarnos (Prod. IBS) [LeFLMs],220833,463,768,10219,0,62GBxxExuC8
de que país es?﻿,Rels B - Vamos a Mirarnos (Prod. IBS) [LeFLMs],220833,463,768,10219,0,62GBxxExuC8
"Me recuerda mucho a un viaje astral que tuve hace poco y lo recorde, me pasa algo parecido con un alma extraña seguramente de poca luz...﻿",Rels B - Vamos a Mirarnos (Prod. IBS) [LeFLMs],220833,463,768,10219,0,62GBxxExuC8
Menuda mierda﻿,Rels B - Vamos a Mirarnos (Prod. IBS) [LeFLMs],220833,463,768,10219,0,62GBxxExuC8
uuu todo fue rapito rapito jaja<br />precoz cof cof﻿,Rels B - Vamos a Mirarnos (Prod. IBS) [LeFLMs],220833,463,768,10219,0,62GBxxExuC8
Shit! como que me trae recuerdos buenos pero malos porque se termino...﻿,Rels B - Vamos a Mirarnos (Prod. IBS) [LeFLMs],220833,463,768,10219,0,62GBxxExuC8
"Muy buen tema y muy bien trabajado el videoclip, me ha encantado.﻿",Rels B - Vamos a Mirarnos (Prod. IBS) [LeFLMs],220833,463,768,10219,0,62GBxxExuC8
Me encanta &lt;3﻿,Rels B - Vamos a Mirarnos (Prod. IBS) [LeFLMs],220833,463,768,10219,0,62GBxxExuC8
Cual es el nombre de la chica? Es para una tarea﻿,Rels B - Vamos a Mirarnos (Prod. IBS) [LeFLMs],220833,463,768,10219,0,62GBxxExuC8
