comment,title,views,dislikes,commentCount,likes,replies,id
"<b>El título correcto del vídeo sería: &quot;hombre PAJERO graba su propia muerte&quot;... la verdad es que hay que ser BOLUDO para hacer eso... que se joda, bien muerto está. &quot;Sarna con gusto no pica&quot;</b>﻿","Saltador graba su propia muerte en directo - Armin Schmieder ""hombre pajaro""",471000,1382,197,255,4,xH1z6BbcolU
vaya mierda de vídeo .﻿,"Saltador graba su propia muerte en directo - Armin Schmieder ""hombre pajaro""",471000,1382,197,255,0,xH1z6BbcolU
valla put@ mierd@ de video..te vas a llevar mi deslike y mi denuncia﻿,"Saltador graba su propia muerte en directo - Armin Schmieder ""hombre pajaro""",471000,1382,197,255,3,xH1z6BbcolU
Clickbait﻿,"Saltador graba su propia muerte en directo - Armin Schmieder ""hombre pajaro""",471000,1382,197,255,0,xH1z6BbcolU
"empece a verlo desde el minuto <a href=""http://www.youtube.com/watch?v=xH1z6BbcolU&amp;t=6m20s"">6:20</a>﻿","Saltador graba su propia muerte en directo - Armin Schmieder ""hombre pajaro""",471000,1382,197,255,0,xH1z6BbcolU
Denunciado xd entre que estoy de mala ostia y tu mierda de viddo ....﻿,"Saltador graba su propia muerte en directo - Armin Schmieder ""hombre pajaro""",471000,1382,197,255,0,xH1z6BbcolU
porquería de video no se ve nada﻿,"Saltador graba su propia muerte en directo - Armin Schmieder ""hombre pajaro""",471000,1382,197,255,0,xH1z6BbcolU
no vimos nada ce mierda﻿,"Saltador graba su propia muerte en directo - Armin Schmieder ""hombre pajaro""",471000,1382,197,255,0,xH1z6BbcolU
"el peor video q e visto en  mi vida, dislaik﻿","Saltador graba su propia muerte en directo - Armin Schmieder ""hombre pajaro""",471000,1382,197,255,0,xH1z6BbcolU
El vídeo tiene menos definición que Higuaín﻿,"Saltador graba su propia muerte en directo - Armin Schmieder ""hombre pajaro""",471000,1382,197,255,3,xH1z6BbcolU
"una mierda el video , no se ve un carajo﻿","Saltador graba su propia muerte en directo - Armin Schmieder ""hombre pajaro""",471000,1382,197,255,0,xH1z6BbcolU
"una mierda el video , no se ve un carajo﻿","Saltador graba su propia muerte en directo - Armin Schmieder ""hombre pajaro""",471000,1382,197,255,0,xH1z6BbcolU
MUuuuuuuuuuuuuuuuuuuuuuuuuuu﻿,"Saltador graba su propia muerte en directo - Armin Schmieder ""hombre pajaro""",471000,1382,197,255,0,xH1z6BbcolU
justo anda la camara del bolsillo 😂<br />la proxima que mueras graba con las cámaras del casco.﻿,"Saltador graba su propia muerte en directo - Armin Schmieder ""hombre pajaro""",471000,1382,197,255,0,xH1z6BbcolU
Para q subes esta mierda ?﻿,"Saltador graba su propia muerte en directo - Armin Schmieder ""hombre pajaro""",471000,1382,197,255,0,xH1z6BbcolU
"Buen video, Exelente, Si puedes Visita Mi canal De Juegos Llamado Benja Fail Games, Se que es spam, pero como subire!! Y un like a tu video﻿","Saltador graba su propia muerte en directo - Armin Schmieder ""hombre pajaro""",471000,1382,197,255,0,xH1z6BbcolU
Se lo comen las vacas y pasa esto﻿,"Saltador graba su propia muerte en directo - Armin Schmieder ""hombre pajaro""",471000,1382,197,255,0,xH1z6BbcolU
porfa llamen y hagan una broma a este num wsp +54 9 381 300-5491﻿,"Saltador graba su propia muerte en directo - Armin Schmieder ""hombre pajaro""",471000,1382,197,255,1,xH1z6BbcolU
오나 년 ㅏ리ㅣㅣㅇ 뇬난﻿,"Saltador graba su propia muerte en directo - Armin Schmieder ""hombre pajaro""",471000,1382,197,255,2,xH1z6BbcolU
lo siento por el hombre﻿,"Saltador graba su propia muerte en directo - Armin Schmieder ""hombre pajaro""",471000,1382,197,255,0,xH1z6BbcolU
q estafa﻿,"Saltador graba su propia muerte en directo - Armin Schmieder ""hombre pajaro""",471000,1382,197,255,0,xH1z6BbcolU
"Buenos dias, en este video se ve que el tipo tapa la cámara por lo que no habría razón para llevarla a grabar, y al no verse nada no se puede justificar su muerte.<br />por otra parte entiendo que tu intención no fue un clickbait si no que tu piensas que realmente ocurrio.<br />SI NO LES PARECE VERDAD DIFUNDAN NO CRITIQUEN AL CHAVON QUE NADA MAS LO RESUBIO.﻿","Saltador graba su propia muerte en directo - Armin Schmieder ""hombre pajaro""",471000,1382,197,255,0,xH1z6BbcolU
como puedo saber si no son efectos eapeciales﻿,"Saltador graba su propia muerte en directo - Armin Schmieder ""hombre pajaro""",471000,1382,197,255,0,xH1z6BbcolU
clickbait﻿,"Saltador graba su propia muerte en directo - Armin Schmieder ""hombre pajaro""",471000,1382,197,255,0,xH1z6BbcolU
pobres los que vieron la transmisión😖﻿,"Saltador graba su propia muerte en directo - Armin Schmieder ""hombre pajaro""",471000,1382,197,255,4,xH1z6BbcolU
Culiao Aweonao﻿,"Saltador graba su propia muerte en directo - Armin Schmieder ""hombre pajaro""",471000,1382,197,255,1,xH1z6BbcolU
clickbait!!!﻿,"Saltador graba su propia muerte en directo - Armin Schmieder ""hombre pajaro""",471000,1382,197,255,0,xH1z6BbcolU
El vídeo es verídico. Basta con escuchar los gemidos del tipo para darse cuenta que son sus reacciones post-mortem.﻿,"Saltador graba su propia muerte en directo - Armin Schmieder ""hombre pajaro""",471000,1382,197,255,0,xH1z6BbcolU
el tipo medio idiota igual en el casco tenía el palo para poder la cámara y se la deja en la mano tapada﻿,"Saltador graba su propia muerte en directo - Armin Schmieder ""hombre pajaro""",471000,1382,197,255,0,xH1z6BbcolU
"mu tonto , tonto y bacin con ganas de morir y joderle la vida a tu famia poco amor a tu vida,no es mas fácil hechar unas cervezas con los amigos jugando al billar﻿","Saltador graba su propia muerte en directo - Armin Schmieder ""hombre pajaro""",471000,1382,197,255,0,xH1z6BbcolU
pobre... descanse en paz﻿,"Saltador graba su propia muerte en directo - Armin Schmieder ""hombre pajaro""",471000,1382,197,255,0,xH1z6BbcolU
clickbait﻿,"Saltador graba su propia muerte en directo - Armin Schmieder ""hombre pajaro""",471000,1382,197,255,0,xH1z6BbcolU
No tienes derecho alguno de subir esto﻿,"Saltador graba su propia muerte en directo - Armin Schmieder ""hombre pajaro""",471000,1382,197,255,0,xH1z6BbcolU
claro a dalasrewiw poniendo titulos que son de lo que habla en el video le dicen que hace clicbait y a este título engañoso no vaya logica﻿,"Saltador graba su propia muerte en directo - Armin Schmieder ""hombre pajaro""",471000,1382,197,255,0,xH1z6BbcolU
el solamente queria ser popular﻿,"Saltador graba su propia muerte en directo - Armin Schmieder ""hombre pajaro""",471000,1382,197,255,0,xH1z6BbcolU
puto video puta mierda y puto todooooooo !!!﻿,"Saltador graba su propia muerte en directo - Armin Schmieder ""hombre pajaro""",471000,1382,197,255,0,xH1z6BbcolU
"hola , quiero aclarar que no gano nada por este video, que youtube desde que lo subi, no me dejo monetizar , youtube es claro en eso, si piensan que estoy lucrando con esto, estan confundidos, hagan la prueba y veran que no les dejara ganar, solo publicar, igual gracias a todos y Bienvenidos. abrazos﻿","Saltador graba su propia muerte en directo - Armin Schmieder ""hombre pajaro""",471000,1382,197,255,7,xH1z6BbcolU
k eso es todo mentira﻿,"Saltador graba su propia muerte en directo - Armin Schmieder ""hombre pajaro""",471000,1382,197,255,0,xH1z6BbcolU
si prestan atención parece que rebota varias veces en un acantilado... hay que usar la imaginación nada más﻿,"Saltador graba su propia muerte en directo - Armin Schmieder ""hombre pajaro""",471000,1382,197,255,0,xH1z6BbcolU
Es mas falso que tu abuela vete a jugar al hello kitty online﻿,"Saltador graba su propia muerte en directo - Armin Schmieder ""hombre pajaro""",471000,1382,197,255,1,xH1z6BbcolU
"esto es fake, yo le creería si lo hubiese subido desde la otra cámara, pero como no se ve nada no lo creo﻿","Saltador graba su propia muerte en directo - Armin Schmieder ""hombre pajaro""",471000,1382,197,255,9,xH1z6BbcolU
Y si esta &quot;muerto&quot; porque acá se subió el video﻿,"Saltador graba su propia muerte en directo - Armin Schmieder ""hombre pajaro""",471000,1382,197,255,5,xH1z6BbcolU
un minuto de silencio xd﻿,"Saltador graba su propia muerte en directo - Armin Schmieder ""hombre pajaro""",471000,1382,197,255,0,xH1z6BbcolU
pobre chaval﻿,"Saltador graba su propia muerte en directo - Armin Schmieder ""hombre pajaro""",471000,1382,197,255,1,xH1z6BbcolU
holasss﻿,TIE-DYE: TEÑIMOS NUESTRA ROPA!,284189,540,874,18204,0,tFxgWafy3Us
otra cosa sois las mejores﻿,TIE-DYE: TEÑIMOS NUESTRA ROPA!,284189,540,874,18204,0,tFxgWafy3Us
"Paula que día de septiembre es tu cumpleaños? Perdón por no saberlo es que soy nuevo desde dos semanas.<br />(PD) Lo de tu cumple lo de de un video tuyo de hace un año,pero en ese video no decías el dia﻿",TIE-DYE: TEÑIMOS NUESTRA ROPA!,284189,540,874,18204,0,tFxgWafy3Us
Chicasss yo tb hago eso pero donde lo habeis comprado? donde lo compro yo no hay tantos colores... gracias guapas!﻿,TIE-DYE: TEÑIMOS NUESTRA ROPA!,284189,540,874,18204,0,tFxgWafy3Us
"<a href=""http://www.youtube.com/watch?v=tFxgWafy3Us&amp;t=0m04s"">0:04</a>﻿",TIE-DYE: TEÑIMOS NUESTRA ROPA!,284189,540,874,18204,0,tFxgWafy3Us
¿¿Pero a qué viene gritar tanto??﻿,TIE-DYE: TEÑIMOS NUESTRA ROPA!,284189,540,874,18204,0,tFxgWafy3Us
De donde son los tintes?﻿,TIE-DYE: TEÑIMOS NUESTRA ROPA!,284189,540,874,18204,0,tFxgWafy3Us
Canción del principio?﻿,TIE-DYE: TEÑIMOS NUESTRA ROPA!,284189,540,874,18204,0,tFxgWafy3Us
Juro que no he entrada para verlas en bikini... Palabra!﻿,TIE-DYE: TEÑIMOS NUESTRA ROPA!,284189,540,874,18204,0,tFxgWafy3Us
acabo de descubrir el canal.... lo amoooo me encanto su simpatia y sois muy graciosas﻿,TIE-DYE: TEÑIMOS NUESTRA ROPA!,284189,540,874,18204,0,tFxgWafy3Us
me enamora la rubia está😍﻿,TIE-DYE: TEÑIMOS NUESTRA ROPA!,284189,540,874,18204,0,tFxgWafy3Us
pau: sos super loca :333333﻿,TIE-DYE: TEÑIMOS NUESTRA ROPA!,284189,540,874,18204,0,tFxgWafy3Us
me gustaría ver mas de estos videos﻿,TIE-DYE: TEÑIMOS NUESTRA ROPA!,284189,540,874,18204,0,tFxgWafy3Us
Yo hice tie-dye la semana pasada! 😄﻿,TIE-DYE: TEÑIMOS NUESTRA ROPA!,284189,540,874,18204,0,tFxgWafy3Us
Me gustan las zanaorias﻿,TIE-DYE: TEÑIMOS NUESTRA ROPA!,284189,540,874,18204,0,tFxgWafy3Us
like para que hagan un vídeo como mi último video la idea es buena﻿,TIE-DYE: TEÑIMOS NUESTRA ROPA!,284189,540,874,18204,0,tFxgWafy3Us
Jaajajajaj el finaal😂😂😂﻿,TIE-DYE: TEÑIMOS NUESTRA ROPA!,284189,540,874,18204,0,tFxgWafy3Us
Qué hacía con mi vida sin ver un vídeo vuestro?Me encantais💜﻿,TIE-DYE: TEÑIMOS NUESTRA ROPA!,284189,540,874,18204,1,tFxgWafy3Us
Yo creia que ibaís ha enseñar la ropa como había quedado :(. ¿Lo podríais poner en el siguiente vídeo o haul?﻿,TIE-DYE: TEÑIMOS NUESTRA ROPA!,284189,540,874,18204,0,tFxgWafy3Us
ya lo vi mas tarde muchas gracias y bonitas deportivas Gio﻿,TIE-DYE: TEÑIMOS NUESTRA ROPA!,284189,540,874,18204,0,tFxgWafy3Us
Quien ha venido aqui por el video de ILeoVlogs?﻿,TIE-DYE: TEÑIMOS NUESTRA ROPA!,284189,540,874,18204,0,tFxgWafy3Us
Que buena idea voy a por el top :-)﻿,TIE-DYE: TEÑIMOS NUESTRA ROPA!,284189,540,874,18204,0,tFxgWafy3Us
😍﻿,TIE-DYE: TEÑIMOS NUESTRA ROPA!,284189,540,874,18204,0,tFxgWafy3Us
vuestro snapchat cual es?﻿,TIE-DYE: TEÑIMOS NUESTRA ROPA!,284189,540,874,18204,1,tFxgWafy3Us
Sin duda mi canal favorito👌 os mereceis muchisimos suscriptores mas de los que teneis chicas❤﻿,TIE-DYE: TEÑIMOS NUESTRA ROPA!,284189,540,874,18204,2,tFxgWafy3Us
madre mia la tonteria que hay en este canal 😂😂😂😂﻿,TIE-DYE: TEÑIMOS NUESTRA ROPA!,284189,540,874,18204,0,tFxgWafy3Us
Seguidnos﻿,TIE-DYE: TEÑIMOS NUESTRA ROPA!,284189,540,874,18204,0,tFxgWafy3Us
me encantan las zapatillas de Gio😝﻿,TIE-DYE: TEÑIMOS NUESTRA ROPA!,284189,540,874,18204,0,tFxgWafy3Us
Como se llama la camcion del peincipio???﻿,TIE-DYE: TEÑIMOS NUESTRA ROPA!,284189,540,874,18204,0,tFxgWafy3Us
El top y los tenis.. 😍😍😍 Definitivamente haré mis versiones! Un beso chicas!﻿,TIE-DYE: TEÑIMOS NUESTRA ROPA!,284189,540,874,18204,1,tFxgWafy3Us
Celo sexy!!😂😂😂 con doble sentido😂﻿,TIE-DYE: TEÑIMOS NUESTRA ROPA!,284189,540,874,18204,0,tFxgWafy3Us
Paula guapaaa﻿,TIE-DYE: TEÑIMOS NUESTRA ROPA!,284189,540,874,18204,0,tFxgWafy3Us
seguidme en mi canal﻿,TIE-DYE: TEÑIMOS NUESTRA ROPA!,284189,540,874,18204,0,tFxgWafy3Us
Lool ese mercadona esta cerca de mi casa :v estoy flipando very mucho﻿,TIE-DYE: TEÑIMOS NUESTRA ROPA!,284189,540,874,18204,0,tFxgWafy3Us
Ha faltado enseñar al final todas las prendas puestaaaas﻿,TIE-DYE: TEÑIMOS NUESTRA ROPA!,284189,540,874,18204,0,tFxgWafy3Us
las amo coño &lt;3<br /><br />me suscribo mi mejor amiga y yo somos iguales las hamo &lt;3﻿,TIE-DYE: TEÑIMOS NUESTRA ROPA!,284189,540,874,18204,0,tFxgWafy3Us
tome un laik buena persona﻿,TIE-DYE: TEÑIMOS NUESTRA ROPA!,284189,540,874,18204,1,tFxgWafy3Us
"<a href=""http://www.youtube.com/watch?v=tFxgWafy3Us&amp;t=6m12s"">6:12</a> sssi no me gustahhhhh😂😂😂😂😂😂😂😂😂﻿",TIE-DYE: TEÑIMOS NUESTRA ROPA!,284189,540,874,18204,0,tFxgWafy3Us
"Voy a ser sincero, he entrado por la miniatura😉﻿",TIE-DYE: TEÑIMOS NUESTRA ROPA!,284189,540,874,18204,5,tFxgWafy3Us
llamadme loca pero la tercera prensa que enseño es un sujetador :v no un top﻿,TIE-DYE: TEÑIMOS NUESTRA ROPA!,284189,540,874,18204,0,tFxgWafy3Us
"<a href=""http://www.youtube.com/watch?v=tFxgWafy3Us&amp;t=0m04s"">0:04</a> :v﻿",TIE-DYE: TEÑIMOS NUESTRA ROPA!,284189,540,874,18204,0,tFxgWafy3Us
Hacer mas sorteos de ropa porfaas﻿,TIE-DYE: TEÑIMOS NUESTRA ROPA!,284189,540,874,18204,0,tFxgWafy3Us
muy chuli me encanta y me habeis hecho reir﻿,TIE-DYE: TEÑIMOS NUESTRA ROPA!,284189,540,874,18204,0,tFxgWafy3Us
Yo también soy Baena de apellido me ha encantado vuestro canal!! Like y Subscripción! 😀😀👍👍﻿,TIE-DYE: TEÑIMOS NUESTRA ROPA!,284189,540,874,18204,2,tFxgWafy3Us
"Chicassss 😇😇 ami me gustaria q hicierais un video q agais gimnasia ritmica abriros de piernas,el pino , el puente .... pero todo esto no os tiene q salir bien  del todo ,  lo q teneis q hacer en el video es hacernos reir, porfa hacerlo﻿",TIE-DYE: TEÑIMOS NUESTRA ROPA!,284189,540,874,18204,0,tFxgWafy3Us
enserio esk veo tus videos paula pork eres mi prototipo de futura novia 😍😍 jajaja﻿,TIE-DYE: TEÑIMOS NUESTRA ROPA!,284189,540,874,18204,0,tFxgWafy3Us
"<a href=""https://i.ytimg.com/vi/tFxgWafy3Us/maxresdefault.jpg"">https://i.ytimg.com/vi/tFxgWafy3Us/maxresdefault.jpg</a><br /><br />De nada﻿",TIE-DYE: TEÑIMOS NUESTRA ROPA!,284189,540,874,18204,0,tFxgWafy3Us
LAS AMO﻿,TIE-DYE: TEÑIMOS NUESTRA ROPA!,284189,540,874,18204,0,tFxgWafy3Us
como se llama la primera cancion﻿,TIE-DYE: TEÑIMOS NUESTRA ROPA!,284189,540,874,18204,0,tFxgWafy3Us
me encanta su locura﻿,TIE-DYE: TEÑIMOS NUESTRA ROPA!,284189,540,874,18204,0,tFxgWafy3Us
Jajajajajjaja ja nwa en el coche﻿,TIE-DYE: TEÑIMOS NUESTRA ROPA!,284189,540,874,18204,0,tFxgWafy3Us
Ay me cague de la risa ganaron nueva sub😀﻿,TIE-DYE: TEÑIMOS NUESTRA ROPA!,284189,540,874,18204,0,tFxgWafy3Us
"-&quot;Mira, sale agua transparente&quot; <a href=""http://www.youtube.com/watch?v=tFxgWafy3Us&amp;t=4m00s"">4:00</a><br />   <br />                     Giovanna Bravar <br />                               2016﻿",TIE-DYE: TEÑIMOS NUESTRA ROPA!,284189,540,874,18204,0,tFxgWafy3Us
"Sigo sin poder creer que no tengan más suscriptores por qué son increíbles 🤘🏼😂 las amo,me hacen reír todo el video jajaja y me encanto como quedo la ropa❤️﻿",TIE-DYE: TEÑIMOS NUESTRA ROPA!,284189,540,874,18204,0,tFxgWafy3Us
estais super locas﻿,TIE-DYE: TEÑIMOS NUESTRA ROPA!,284189,540,874,18204,1,tFxgWafy3Us
las dos x igual son las mejores youtubers q he visto!﻿,TIE-DYE: TEÑIMOS NUESTRA ROPA!,284189,540,874,18204,0,tFxgWafy3Us
Yo eso de hacer rollitos lo veía de pequeño en Caillou jajajajajajaja﻿,TIE-DYE: TEÑIMOS NUESTRA ROPA!,284189,540,874,18204,0,tFxgWafy3Us
Pedazo de patiooooo 😻😻﻿,TIE-DYE: TEÑIMOS NUESTRA ROPA!,284189,540,874,18204,0,tFxgWafy3Us
"Yo si me encontrase en el super a Paula con la mascara esa puesta, me asustaría xD﻿",TIE-DYE: TEÑIMOS NUESTRA ROPA!,284189,540,874,18204,0,tFxgWafy3Us
me encantan vuestros vídeos y  me hacéis reír un montón pero una pregunta ¿Cómo quedo la ultima camiseta?﻿,TIE-DYE: TEÑIMOS NUESTRA ROPA!,284189,540,874,18204,1,tFxgWafy3Us
CUANTO VALE TODO!!! <br />CUANTO VALE TODO!!!!!!!!!!!!!!﻿,TIE-DYE: TEÑIMOS NUESTRA ROPA!,284189,540,874,18204,0,tFxgWafy3Us
Joder la Paula si tiene ese tono de piel en verano no me imagino en invierno seta translúcida :v﻿,TIE-DYE: TEÑIMOS NUESTRA ROPA!,284189,540,874,18204,0,tFxgWafy3Us
"<a href=""http://www.youtube.com/watch?v=tFxgWafy3Us&amp;t=4m00s"">4:00</a> aprox. &quot;eh,mira,sale agua transparente&quot; JAJAJAJA A PENSABA QUE A LO MEJOR SALIA AGUA COLOR MADERA﻿",TIE-DYE: TEÑIMOS NUESTRA ROPA!,284189,540,874,18204,1,tFxgWafy3Us
de dnd son?﻿,TIE-DYE: TEÑIMOS NUESTRA ROPA!,284189,540,874,18204,0,tFxgWafy3Us
os menciono inesmellaman hacer unvideo porfiiiiiiii﻿,TIE-DYE: TEÑIMOS NUESTRA ROPA!,284189,540,874,18204,0,tFxgWafy3Us
😂😂 Lol me he reído mucho﻿,TIE-DYE: TEÑIMOS NUESTRA ROPA!,284189,540,874,18204,0,tFxgWafy3Us
Tips usar guantes al hacer esto y no usar mucha agua. Para tenir sólo se necesita muy poco agua como la de una botella chica o mediana dependiendo de la prenda a tenir y la esta. Pd: sois unas locas.﻿,TIE-DYE: TEÑIMOS NUESTRA ROPA!,284189,540,874,18204,0,tFxgWafy3Us
daaam daniel﻿,TIE-DYE: TEÑIMOS NUESTRA ROPA!,284189,540,874,18204,0,tFxgWafy3Us
me encantais de verdad﻿,TIE-DYE: TEÑIMOS NUESTRA ROPA!,284189,540,874,18204,0,tFxgWafy3Us
que es coña os quiero a las dos﻿,TIE-DYE: TEÑIMOS NUESTRA ROPA!,284189,540,874,18204,0,tFxgWafy3Us
que es coña os quiero a las dos﻿,TIE-DYE: TEÑIMOS NUESTRA ROPA!,284189,540,874,18204,0,tFxgWafy3Us
lo siento paula pero preferemos a joana﻿,TIE-DYE: TEÑIMOS NUESTRA ROPA!,284189,540,874,18204,0,tFxgWafy3Us
me haceis reir muchisimo﻿,TIE-DYE: TEÑIMOS NUESTRA ROPA!,284189,540,874,18204,0,tFxgWafy3Us
me encantan los zapatos en serio﻿,TIE-DYE: TEÑIMOS NUESTRA ROPA!,284189,540,874,18204,0,tFxgWafy3Us
Los zapatos quedaron super lindos❤️ Saludooooooooos❤️﻿,TIE-DYE: TEÑIMOS NUESTRA ROPA!,284189,540,874,18204,0,tFxgWafy3Us
"Yo tengo las vans de la foto!!! Y todo el mundo me pregunta si están desteñidas y yo como: NO, BITCH SON ASÍ!﻿",TIE-DYE: TEÑIMOS NUESTRA ROPA!,284189,540,874,18204,0,tFxgWafy3Us
"Si queréis teñir ropa en serio os recomiendo que veáis el video que subió el canal de DaretoDIY hace 3 semanas, está muy chulo.﻿",TIE-DYE: TEÑIMOS NUESTRA ROPA!,284189,540,874,18204,0,tFxgWafy3Us
"Me mola muchíiiiisimo vuestros videos, y vosotras también. Me gustaría que me dijerais cuales son las canciones que poneis en los videos. Gracias!!!♚﻿",TIE-DYE: TEÑIMOS NUESTRA ROPA!,284189,540,874,18204,0,tFxgWafy3Us
me encanta este canal!!!! jajajaja﻿,TIE-DYE: TEÑIMOS NUESTRA ROPA!,284189,540,874,18204,0,tFxgWafy3Us
haa estado guaay lo que no enseñaron bien los resultados:(﻿,TIE-DYE: TEÑIMOS NUESTRA ROPA!,284189,540,874,18204,0,tFxgWafy3Us
Me molan  todas las prendas!! Esta súper chulooo!! Sois genialeees😍😍😘😘💕👣📷﻿,TIE-DYE: TEÑIMOS NUESTRA ROPA!,284189,540,874,18204,0,tFxgWafy3Us
Like si repetiste el momento en el q enseña sus pechos😂😂﻿,TIE-DYE: TEÑIMOS NUESTRA ROPA!,284189,540,874,18204,0,tFxgWafy3Us
Podriais hacer el youtuber tag?!😘😘😘﻿,TIE-DYE: TEÑIMOS NUESTRA ROPA!,284189,540,874,18204,0,tFxgWafy3Us
Me encanta <br />para el próximo videos pueden hacer el reto de la sandía ??﻿,TIE-DYE: TEÑIMOS NUESTRA ROPA!,284189,540,874,18204,0,tFxgWafy3Us
"Que gia la ropaaaa,esta chulosisima!!﻿",TIE-DYE: TEÑIMOS NUESTRA ROPA!,284189,540,874,18204,0,tFxgWafy3Us
Inesmellaan quiere hacer un vide con vosotras!!!﻿,TIE-DYE: TEÑIMOS NUESTRA ROPA!,284189,540,874,18204,0,tFxgWafy3Us
de donde son los tintes????﻿,TIE-DYE: TEÑIMOS NUESTRA ROPA!,284189,540,874,18204,0,tFxgWafy3Us
a velocidad 0.5 la droga se apodera de ellas﻿,TIE-DYE: TEÑIMOS NUESTRA ROPA!,284189,540,874,18204,0,tFxgWafy3Us
"Hola amigos! si queréis ver un canal nuevo sobre vlogs, viajes, y videos varios no olvidéis pasaros por mi canal ;) OS ENCANTARÁ!﻿",TIE-DYE: TEÑIMOS NUESTRA ROPA!,284189,540,874,18204,0,tFxgWafy3Us
En algun super en concreto? ajja﻿,TIE-DYE: TEÑIMOS NUESTRA ROPA!,284189,540,874,18204,0,tFxgWafy3Us
El resultadooo porfa chicaas😫﻿,TIE-DYE: TEÑIMOS NUESTRA ROPA!,284189,540,874,18204,0,tFxgWafy3Us
EN QUE SUPEEEEEEER﻿,TIE-DYE: TEÑIMOS NUESTRA ROPA!,284189,540,874,18204,0,tFxgWafy3Us
"Hola,muy buen video ¡me encanta! Te invito a que te pases por mi canal,muchos besos!﻿",TIE-DYE: TEÑIMOS NUESTRA ROPA!,284189,540,874,18204,0,tFxgWafy3Us
Os ha quedado genial. Gio siento decirte que tu locura en cada vídeo va a más xD﻿,TIE-DYE: TEÑIMOS NUESTRA ROPA!,284189,540,874,18204,0,tFxgWafy3Us
"Si queréis que los círculos que habéis hecho con las gomitas os queden mas blancos, usad hilo de pescar, que va mejor.﻿",TIE-DYE: TEÑIMOS NUESTRA ROPA!,284189,540,874,18204,0,tFxgWafy3Us
Hola SI QUIEREN SE PUEDEN PASAR POR MI CANAL YO AR LO MISMO!!﻿,TIE-DYE: TEÑIMOS NUESTRA ROPA!,284189,540,874,18204,0,tFxgWafy3Us
sois las mas guapas del mundo﻿,TIE-DYE: TEÑIMOS NUESTRA ROPA!,284189,540,874,18204,0,tFxgWafy3Us
Precioso la verdad ^^﻿,TIE-DYE: TEÑIMOS NUESTRA ROPA!,284189,540,874,18204,0,tFxgWafy3Us
Estais como una cabra😂😂❤️❤️﻿,TIE-DYE: TEÑIMOS NUESTRA ROPA!,284189,540,874,18204,0,tFxgWafy3Us
Pero lo más importante es... CUANTO VALE TODO??﻿,TIE-DYE: TEÑIMOS NUESTRA ROPA!,284189,540,874,18204,1,tFxgWafy3Us
graba otro bidio de pokemon go﻿,POKEMON GO - EL SECRETO DE DITTO EL MAS DIFÍCIL DE ENCONTRAR - NexxuzHD,1748085,5545,5329,54297,0,urT2SuhjwIg
En todo caso el continente que falta es África .....﻿,POKEMON GO - EL SECRETO DE DITTO EL MAS DIFÍCIL DE ENCONTRAR - NexxuzHD,1748085,5545,5329,54297,0,urT2SuhjwIg
xq ya no subes gta 5﻿,POKEMON GO - EL SECRETO DE DITTO EL MAS DIFÍCIL DE ENCONTRAR - NexxuzHD,1748085,5545,5329,54297,0,urT2SuhjwIg
ahora estados unidos es un continente.....<br /><br />bravooooooo... shiii eres un genial .<br /><br />tu descubriras la cura del cancer y el sida pequeño nexxus﻿,POKEMON GO - EL SECRETO DE DITTO EL MAS DIFÍCIL DE ENCONTRAR - NexxuzHD,1748085,5545,5329,54297,0,urT2SuhjwIg
emm nexus latino america tambien es parte de america﻿,POKEMON GO - EL SECRETO DE DITTO EL MAS DIFÍCIL DE ENCONTRAR - NexxuzHD,1748085,5545,5329,54297,0,urT2SuhjwIg
ditto es el de latino america yo lo se porque soy de colombia y tengo tengo iphone 6﻿,POKEMON GO - EL SECRETO DE DITTO EL MAS DIFÍCIL DE ENCONTRAR - NexxuzHD,1748085,5545,5329,54297,0,urT2SuhjwIg
como se llama la canción que uso﻿,POKEMON GO - EL SECRETO DE DITTO EL MAS DIFÍCIL DE ENCONTRAR - NexxuzHD,1748085,5545,5329,54297,0,urT2SuhjwIg
EL POKEMON FAVORITO DE PERU ES MEWOTWO﻿,POKEMON GO - EL SECRETO DE DITTO EL MAS DIFÍCIL DE ENCONTRAR - NexxuzHD,1748085,5545,5329,54297,0,urT2SuhjwIg
Yo tengo un huevo de un kilómetro﻿,POKEMON GO - EL SECRETO DE DITTO EL MAS DIFÍCIL DE ENCONTRAR - NexxuzHD,1748085,5545,5329,54297,0,urT2SuhjwIg
Ninguna de las que dices<br />El codigo de los pokemones legendarios aun Niantic no lo ha desbloqueado﻿,POKEMON GO - EL SECRETO DE DITTO EL MAS DIFÍCIL DE ENCONTRAR - NexxuzHD,1748085,5545,5329,54297,0,urT2SuhjwIg
te veo desde monterrey nuevo león Mexico y me gustan tus videos pero tardas mucho en subir un video﻿,POKEMON GO - EL SECRETO DE DITTO EL MAS DIFÍCIL DE ENCONTRAR - NexxuzHD,1748085,5545,5329,54297,0,urT2SuhjwIg
nexxuz puedes aser un video de como aser un parkour en gta v online plis.respondeme plis﻿,POKEMON GO - EL SECRETO DE DITTO EL MAS DIFÍCIL DE ENCONTRAR - NexxuzHD,1748085,5545,5329,54297,0,urT2SuhjwIg
hay una teoria q ditto es el clon bueno de ditto﻿,POKEMON GO - EL SECRETO DE DITTO EL MAS DIFÍCIL DE ENCONTRAR - NexxuzHD,1748085,5545,5329,54297,0,urT2SuhjwIg
Nexxus !!!! Ve al canal de Marcianophone gaming y el reprogramo los códigos del juego y saco los legendarios.  Espero y veas mi comentario :O﻿,POKEMON GO - EL SECRETO DE DITTO EL MAS DIFÍCIL DE ENCONTRAR - NexxuzHD,1748085,5545,5329,54297,0,urT2SuhjwIg
nexxuz eres el amo﻿,POKEMON GO - EL SECRETO DE DITTO EL MAS DIFÍCIL DE ENCONTRAR - NexxuzHD,1748085,5545,5329,54297,0,urT2SuhjwIg
yo vivo en America Latina y no hay ditos e viajado en todo America﻿,POKEMON GO - EL SECRETO DE DITTO EL MAS DIFÍCIL DE ENCONTRAR - NexxuzHD,1748085,5545,5329,54297,0,urT2SuhjwIg
hola nexxuz como va tatoo?﻿,POKEMON GO - EL SECRETO DE DITTO EL MAS DIFÍCIL DE ENCONTRAR - NexxuzHD,1748085,5545,5329,54297,0,urT2SuhjwIg
"te sale muy mal hacerte el gracioso, de onda te lo digo, vi un minuto de tu vídeo y ya me canso porque te querés hacer el gracioso﻿",POKEMON GO - EL SECRETO DE DITTO EL MAS DIFÍCIL DE ENCONTRAR - NexxuzHD,1748085,5545,5329,54297,0,urT2SuhjwIg
esta sencillo hay que fijarse en los ojos del pokemon Go si son como los de Dito puede ser el﻿,POKEMON GO - EL SECRETO DE DITTO EL MAS DIFÍCIL DE ENCONTRAR - NexxuzHD,1748085,5545,5329,54297,0,urT2SuhjwIg
nexus estaba viendo un video de luzu el cual se llama vuelve el luzumovil y atrapa un lapras entonces cuando dice registrado alado aparece la figura de ditto﻿,POKEMON GO - EL SECRETO DE DITTO EL MAS DIFÍCIL DE ENCONTRAR - NexxuzHD,1748085,5545,5329,54297,0,urT2SuhjwIg
